pmid,title,abstract,journal,year,authors
38735387,Association of intestinal anti-inflammatory drug target genes with psychiatric Disorders: A Mendelian randomization study.,"Psychiatric disorders present a substantial global public health burden with limited drug options. The gut-brain axis connects inflammatory bowel diseases and psychiatric disorders, which often have comorbidities. While some evidence hints at anti-inflammatory drugs aiding in treating psychiatric conditions, the specific effects of intestinal anti-inflammatory drugs remain unclear.This study investigates the causal effect of intestinal anti-inflammatory drug targets on psychiatric disorders. We hypothesize that these drug targets may offer new insights into the treatment and prevention of such disorders. Additionally, we explore gut microbiota's mediating role between drug target genes and psychiatric disorders.We performed two-sample Mendelian randomization (MR) using summary data from existing expression quantitative trait loci (eQTL) and protein QTL in the brain, along with public genome-wide association studies of disease. We also explored gut microbiota's mediating effect. The statistics encompassed six psychiatric disorders involving 9,725-500,199 individuals. Colocalization analysis enhanced the MR evidence.We uncovered a causal link between TPMT (a target of olsalazine) expression in the amygdala and bipolar disorder (BD) risk (odds ratio [OR] = 1.08; P = 4.29 × 10<sup>-4</sup>). This association was observed even when the sigmoid colon and whole blood eQTL were considered as exposures. Colocalization analysis revealed a shared genetic variant (rs11751561) between TPMT expression and BD, with a posterior probability of 61.6 %. Interestingly, this causal effect was influenced by a decrease in the gut microbiota abundance of the genus Roseburia (effect proportion = 10.05 %). Moreover, elevated ACAT1 expression was associated with higher obsessive-compulsive disorder risk (OR = 1.62; P = 3.64 × 10<sup>-4</sup>; posterior probability = 3.1 %).These findings provide novel targets for the treatment of psychiatric disorders, underscore the potential of repurposing olsalazine, and emphasize the importance of TPMT and ACAT1 in future drug development.",Journal of advanced research,2024,Guorui Zhao; Zhe Lu; Yundan Liao; Yaoyao Sun; Yuyanan Zhang; Zhewei Kang; Xiaoyang Feng; Junyuan Sun; Weihua Yue
39317918,"Dysbiosis and fecal microbiota transplant: Contemplating progress in health, neurodegeneration and longevity.","The gut-brain axis plays an important role in mental health. The intestinal epithelial surface is colonized by billions of commensal and transitory bacteria, known as the Gut Microbiota (GM). However, potential pathogens continuously stimulate intestinal immunity when they find the place. The last two decades have witnessed several studies revealing intestinal bacteria as a key factor in the health-disease balance of the gut, as well as disease-emergent in other parts of the body. Various neurological processes, such as cognition, learning, and memory, could be affected by dysbiosis in GM. Additionally, the aging process and longevity are related to systemic inflammation caused by dysbiosis. Commensal GM affects brain development, behavior, and healthy aging suggesting that building changes in GM might be a potential therapeutic method. The innovation in GM dysbiosis is intervention by Fecal Microbiota Transplantation (FMT), which has been confirmed as a therapy for recurrent Clostridium difficile infections and is promising for other clinical disorders, such as Parkinson's disease, Multiple Sclerosis (MS), Alzheimer's disease, and depression. Additionally, FMT may be possible to promote healthy aging, and extend longevity. This review aims to connect dysbiosis, neurological disorders, and aging and the potential of FMT as a therapeutic strategy to treat these disorders, and to enhance the quality of life in the elderly.",Biogerontology,2024,Somayeh Ahmadi; Alka Hasani; Aytak Khabbaz; Vahdat Poortahmasbe; Samaneh Hosseini; Mohammad Yasdchi; Elham Mehdizadehfar; Zahra Mousavi; Roqaiyeh Hasani; Edris Nabizadeh; Javad Nezhadi
38732060,The Role of Prebiotics in Modulating Gut Microbiota: Implications for Human Health.,"The human gut microbiota, an intricate ecosystem within the gastrointestinal tract, plays a pivotal role in health and disease. Prebiotics, non-digestible food ingredients that beneficially affect the host by selectively stimulating the growth and/or activity of beneficial microorganisms, have emerged as a key modulator of this complex microbial community. This review article explores the evolution of the prebiotic concept, delineates various types of prebiotics, including fructans, galactooligosaccharides, xylooligosaccharides, chitooligosaccharides, lactulose, resistant starch, and polyphenols, and elucidates their impact on the gut microbiota composition. We delve into the mechanisms through which prebiotics exert their effects, particularly focusing on producing short-chain fatty acids and modulating the gut microbiota towards a health-promoting composition. The implications of prebiotics on human health are extensively reviewed, focusing on conditions such as obesity, inflammatory bowel disease, immune function, and mental health. The review further discusses the emerging concept of synbiotics-combinations of prebiotics and probiotics that synergistically enhance gut health-and highlights the market potential of prebiotics in response to a growing demand for functional foods. By consolidating current knowledge and identifying areas for future research, this review aims to enhance understanding of prebiotics' role in health and disease, underscoring their importance in maintaining a healthy gut microbiome and overall well-being.",International journal of molecular sciences,2024,Suyeon Yoo; Suk-Chae Jung; Kihyuck Kwak; Jun-Seob Kim
39476179,"The interplay of gut microbiota, obesity, and depression: insights and interventions.","The gut microbiome, body weight, and related comorbidities are intricately linked through a complex interaction of microbial, genetic, environmental, and psychological factors. Alterations in gut microbiota can contribute to the development of weight disorders and depressive symptoms, with the potential for these relationships to be bidirectional. Effective management of these interconnected conditions often involves a combination of lifestyle modifications and psychological support. Medical interventions, including treatments for obesity, antidiabetic drugs, antidepressants, antibiotics, and probiotics, can have beneficial and detrimental effects on gut microbiota and mental health. Further research is needed to better understand their impact on gut microbiome and mental health in the context of obesity.",Cellular and molecular life sciences : CMLS,2024,Iryna Halabitska; Pavlo Petakh; Iryna Kamyshna; Valentyn Oksenych; Denis E Kainov; Oleksandr Kamyshnyi
39287570,Diet and the gut microbiota-immune axis in the context of perinatal mental health: Protocol for a prospective cohort study.,"Physiological and psychosocial changes experienced by women during the perinatal period may put them at risk for postpartum mental health disturbances. Accumulating evidence suggests that dietary patterns may influence mental health through the modulation of the gut microbiota and its effects on host immune activity. Thus, targeting the gut microbiota via dietary intake could serve as both a preventative and therapeutic strategy in improving perinatal mental health.Here, we present a protocol for a prospective cohort study that primarily aims to determine if diet quality during pregnancy is protective against postpartum depression severity. Secondary objectives will examine if microbiota- and blood-based inflammatory markers may be associated with the relationship between prenatal diet quality and postpartum depression severity, as well as with associations between additional dietary and mental health outcomes.Dietary patterns and mental health symptoms will be documented in 100 pregnant women at 4 time points during pregnancy and postpartum. Participants will also provide stool and blood samples at the same time points to determine microbiota composition and predicted function and inflammatory factors, respectively. Stool microbiota will be analyzed using 16S ribosomal RNA gene sequencing and bioinformatics tools (QIIME 2/PICRUSt2). Inflammatory factors will be determined using high-sensitivity antibody-based immunoassays. Statistical analyses will include linear mixed models and hierarchical linear mixed effect models.The study was approved by the Research Ethics Boards of the Royal Ottawa Health Care Group (#2022002) and of the University of Ottawa (#H-06-22-8013). Informed consent will be obtained from all participants before their enrollment.Findings from this study will help develop evidence-based dietary recommendations and potential interventions for women susceptible to or suffering from postpartum mental health issues that are accessible, noninvasive, and have potential to play a role in prevention and treatment.","Women's health (London, England)",2024,Caroline Jk Wallace; Marie-Claude Audet
38960582,Integrated metagenomic and metabolomic analysis reveals distinctive stage-specific gut-microbiome-derived metabolites in intracranial aneurysms.,"Our study aimed to explore the influence of gut microbiota and their metabolites on intracranial aneurysms (IA) progression and pinpoint-related metabolic biomarkers derived from the gut microbiome.We recruited 358 patients with unruptured IA (UIA) and 161 with ruptured IA (RIA) from two distinct geographical regions for conducting an integrated analysis of plasma metabolomics and faecal metagenomics. Machine learning algorithms were employed to develop a classifier model, subsequently validated in an independent cohort. Mouse models of IA were established to verify the potential role of the specific metabolite identified.Distinct shifts in taxonomic and functional profiles of gut microbiota and their related metabolites were observed in different IA stages. Notably, tryptophan metabolites, particularly indoxyl sulfate (IS), were significantly higher in plasma of RIA. Meanwhile, upregulated tryptophanase expression and indole-producing microbiota were observed in gut microbiome of RIA. A model harnessing gut-microbiome-derived tryptophan metabolites demonstrated remarkable efficacy in distinguishing RIA from UIA patients in the validation cohort (AUC=0.97). Gut microbiota depletion by antibiotics decreased plasma IS concentration, reduced IA formation and rupture in mice, and downregulated matrix metalloproteinase-9 expression in aneurysmal walls with elastin degradation reduction. Supplement of IS reversed the effect of gut microbiota depletion.Our investigation highlights the potential of gut-microbiome-derived tryptophan metabolites as biomarkers for distinguishing RIA from UIA patients. The findings suggest a novel pathogenic role for gut-microbiome-derived IS in elastin degradation in the IA wall leading to the rupture of IA.",Gut,2024,Haitao Sun; Kaijian Sun; Hao Tian; Xiheng Chen; Shixing Su; Yi Tu; Shilan Chen; Jiaxuan Wang; Meichang Peng; Meiqin Zeng; Xin Li; Yunhao Luo; Yugu Xie; Xin Feng; Zhuang Li; Xin Zhang; Xifeng Li; Yanchao Liu; Wei Ye; Zhengrui Chen; Zhaohua Zhu; Youxiang Li; Fangbo Xia; Hongwei Zhou; Chuanzhi Duan
38914414,Exploring the gut-brain Axis: Potential therapeutic impact of Psychobiotics on mental health.,"One of the most challenging and controversial issues in microbiome research is related to gut microbial metabolism and neuropsychological disorders. Psychobiotics affect human behavior and central nervous system processes via the gut-brain axis, involving neuronal, immune, and metabolic pathways. They have therapeutic potential in the treatment of several neurodegenerative and neurodevelopmental disorders such as depression, anxiety, autism, attention deficit hyperactivity disorder, Alzheimer's disease, Parkinson's disease, schizophrenia, Huntington's disease, anorexia nervosa, and multiple sclerosis. However, the mechanisms underlying the interaction between psychobiotics and the abovementioned diseases need further exploration. This review focuses on the relationship between gut microbiota and its impact on neurological and neurodegenerative disorders, examining the potential of psychobiotics as a preventive and therapeutic approach, summarising recent research on the gut-brain axis and the potential beneficial effects of psychobiotics, highlighting the need for further research and investigation in this area.",Progress in neuro-psychopharmacology & biological psychiatry,2024,Ana-Maria Cocean; Dan Cristian Vodnar
38908788,Gut microbiota dynamics and association with chronic kidney disease: A longitudinal study within the PREDIMED-Plus trial.,"Chronic kidney disease (CKD) represents a global health concern, disproportionately affecting the elderly with heightened cardiovascular risk. The emerging focus on the gut microbiota's role in CKD pathophysiology represents a pivotal area in nephrology; however, the evidence on this topic is limited. This observational prospective study, in the framework of the PREDIMED-Plus trial, investigates associations between gut microbiota composition and the 1-year trajectory of CKD in 343 participants aged 55-75 years with high cardiovascular risk.Kidney function was assessed at baseline and at 1-year of follow-up through the estimated glomerular filtration rate based on cystatin C (eGFR-CysC) and CKD defined by eGFR-CysC <60 mL/min/1.73 m<sup>2</sup>. Participants were grouped based on their 1-year CKD trajectory: Group 1 maintained normal status or improved from CKD to normal, while Group 2 maintained CKD or worsened from normal to CKD. Fecal microbiota composition was assessed through 16S sequencing.We observed differences in gut microbiota composition between CKD trajectory groups. Notably, the baseline relative abundance of Lachnoclostridium and Lachnospira, both butyrate-producing genera, was lower in participants maintaining or progressing to CKD. Longitudinally, a decrease in Lachnospira abundance was associated with CKD progression. The improved Chao1 index after 1-year follow-up suggests a link between enhanced microbial richness and stable/better kidney function.The findings underscore the potential of gut microbiota analysis in non-invasively monitoring CKD, especially in older populations, and hint at future interventions targeting gut microbiota to manage CKD progression. Further research is needed for causal relationships and generalizability.",Life sciences,2024,Alessandro Atzeni; Andrés Díaz-López; Adrián Hernández Cacho; Nancy Babio; Jesús F García-Gavilán; Isabel Cornejo-Pareja; Clara Belzer; Montserrat Fitó; Francisco J Tinahones; Jordi Salas-Salvadó
39375584,"Animal and plant protein intake association with mental health, tryptophan metabolites pathways, and gut microbiota in healthy women: a cross-sectional study.","Mental health is affected by tryptophane (TRP) metabolism regulation. Diet-influenced gut microbiome regulates TRP metabolism. Thus, the present study aimed to explore the relationship between type of dietary protein intake, gut microbiota, TRP metabolites homeostasis, and mental well-being in healthy women. 91 healthy females aged 18-50 were recruited based on the study protocol. Validate and reliable questionnaires assessed dietary intake and mental health. Biochemical tests and gut microbiota composition were analyzed following the manufacturer's instructions for each enzyme-linked immune sorbent assay (ELISA) kit and Real-time quantitative polymerase chain reaction (qPCR) methods respectively. Regression methods were used to estimate the considered associations. The results show that in the fully adjusted model, plant protein consumption was partially inversely associated with depression risk (OR = 0.27; 95% CI: 0.06, 1.09; P = 0.06). Higher dietary animal protein intake was marginally associated with psychological distress (OR = 2.59; 95% CI: 0.91, 7.34; P = 0.07). KYN to serotonin ratio was inversely associated with animal protein consumption (ß = 1.10; 95% CI: -0.13, 2.33; P = 0.07). Firmicutes/Bacteriodetes ratio (β = -1.27 × 103, SE = 5.99 × 102, P = 0.03) was lower in the top tertile of plant protein. A partially negative correlation was found between dietary animal protein and Prevotella abundance (β = -9.20 × 1018, SE = 5.04 × 1018, P = 0.06). Overall, significant inverse associations were found between a diet high in plant protein with mental disorders, KYN levels, and Firmicutes to Bacteroidetes ratio while adhering to higher animal protein could predispose women to psychological stress.",BMC microbiology,2024,Neda Soveid; Bahareh Barkhidarian; Mahsa Samadi; Mahsa Hatami; Fatemeh Gholami; Mir Saeid Yekaninejad; Ahmad Saedisomeolia; Maryam Karbasian; Seyed Davar Siadat; Khadijeh Mirzaei
39417049,Challenges in integrating traditional Chinese medicine and gut microbiota research for insomnia treatment.,"The gut microbiome is an extensive variety of bacteria with a range of metabolic capabilities that can be pathogenic, beneficial, or opportunistic. Changes in the gut microbiota's composition can affect the link between gut integrity and host health as well as cause disruptions to numerous neurological systems. The second most prevalent mental health problem, insomnia has a negative social and economic impact. Currently, it is becoming increasingly obvious how crucial it is to preserve the delicate balance of gut microbiota to treat illness-related symptoms like insomnia. Although traditional Chinese medicine has proposed an effective strategy against insomnia through gut microbiota alteration in animal models, studies in human models are limited. This decreases the predictive value of the studies in terms of human outcomes. This editorial places an emphasis on cultural sensitivity rather than scientific reasoning that promotes the use of traditional Chinese medicine (TCM). We aim to emphasize the concern that promoting TCM could divert resources from conventional medical research, leading to suboptimal care.",World journal of clinical cases,2024,Maham Bilal; Abdulqadir J Nashwan
38975363,"Dissecting the association between gut microbiota, body mass index and specific depressive symptoms: a mediation Mendelian randomisation study.","Observational studies highlight the association between gut microbiota (GM) composition and depression; however, evidence for the causal relationship between GM and specific depressive symptoms remains lacking.We aimed to evaluate the causal relationship between GM and specific depressive symptoms as well as the mediating role of body mass index (BMI).We performed a two-sample Mendelian randomisation (MR) analysis using genetic variants associated with GM and specific depressive symptoms from genome-wide association studies. The mediating role of BMI was subsequently explored using mediation analysis via two-step MR.MR evidence suggested the <i>Bifidobacterium</i> genus (β=-0.03; 95% CI -0.05 to -0.02; p<0.001 and β=-0.03; 95% CI -0.05 to -0.02; p<0.001) and Actinobacteria phylum (β=-0.04; 95% CI -0.06 to -0.02; p<0.001 and β=-0.03; 95% CI -0.05 to -0.03; p=0.001) had protective effects on both anhedonia and depressed mood. The Actinobacteria phylum also had protective effects on appetite changes (β=-0.04; 95% CI -0.06 to -0.01; p=0.005), while the Family XI had an antiprotective effect (β=0.03; 95% CI 0.01 to 0.04; p<0.001). The Bifidobacteriaceae family (β=-0.01; 95% CI -0.02 to -0.01; p=0.001) and Actinobacteria phylum (β=-0.02; 95% CI -0.03 to -0.01; p=0.001) showed protective effects against suicidality. The two-step MR analysis revealed that BMI also acted as a mediating moderator between the Actinobacteria phylum and appetite changes (mediated proportion, 34.42%) and that BMI partially mediated the effect of the <i>Bifidobacterium</i> genus (14.14% and 8.05%) and Actinobacteria phylum (13.10% and 8.31%) on both anhedonia and depressed mood.These findings suggest a potential therapeutic effect of Actinobacteria and <i>Bifidobacterium</i> on both depression and obesity. Further studies are required to translate these findings into clinical practice.",General psychiatry,2024,Tong Yu; Chengfeng Chen; Yuqing Yang; Mingqia Wang; Yantianyu Yang; Wanting Feng; Shiqi Yuan; Xiancang Ma; Jie Li; Bin Zhang
38901183,Diverse mechanisms by which chemical pollutant exposure alters gut microbiota metabolism and inflammation.,"The human gut microbiome, the host, and the environment are inextricably linked across the life course with significant health impacts. Consisting of trillions of bacteria, fungi, viruses, and other micro-organisms, microbiota living within our gut are particularly dynamic and responsible for digestion and metabolism of diverse classes of ingested chemical pollutants. Exposure to chemical pollutants not only in early life but throughout growth and into adulthood can alter human hosts' ability to absorb and metabolize xenobiotics, nutrients, and other components critical to health and longevity. Inflammation is a common mechanism underlying multiple environmentally related chronic conditions, including cardiovascular disease, multiple cancer types, and mental health. While growing research supports complex interactions between pollutants and the gut microbiome, significant gaps exist. Few reviews provide descriptions of the complex mechanisms by which chemical pollutants interact with the host microbiome through either direct or indirect pathways to alter disease risk, with a particular focus on inflammatory pathways. This review focuses on examples of several classes of pollutants commonly ingested by humans, including (i) heavy metals, (ii) persistent organic pollutants (POPs), and (iii) nitrates. Digestive enzymes and gut microbes are the first line of absorption and metabolism of these chemicals, and gut microbes have been shown to alter compounds from a less to more toxic state influencing subsequent distribution and excretion. In addition, chemical pollutants may interact with or alter the selection of more harmful and less commensal microbiota, leading to gut dysbiosis, and changes in receptor-mediated signaling pathways that alter the integrity and function of the gut intestinal tract. Arsenic, cadmium, and lead (heavy metals), influence the microbiome directly by altering different classes of bacteria, and subsequently driving inflammation through metabolite production and different signaling pathways (LPS/TLR4 or proteoglycan/TLR2 pathways). POPs can alter gut microbial composition either directly or indirectly depending on their ability to activate key signaling pathways within the intestine (e.g., PCB-126 and AHR). Nitrates and nitrites' effect on the gut and host may depend on their ability to be transformed to secondary and tertiary metabolites by gut bacteria. Future research should continue to support foundational research both in vitro, in vivo, and longitudinal population-based research to better identify opportunities for prevention, gain additional mechanistic insights into the complex interactions between environmental pollutants and the microbiome and support additional translational science.",Environment international,2024,Menna Teffera; Alex C Veith; Sean Ronnekleiv-Kelly; Christopher A Bradfield; Maria Nikodemova; Lisa Tussing-Humphreys; Kristen Malecki
39375215,Association of the newly proposed dietary index for gut microbiota and depression: the mediation effect of phenotypic age and body mass index.,"Gut microbiota and depression have garnered attention. The dietary index for gut microbiota (DI-GM) is a newly proposed index that reflects the diversity of gut microbiota, yet its association with depression remains unstudied.Data from the National Health and Nutrition Examination Survey were analyzed. Depression was assessed using Patient Health Questionnaire (PHQ-9). Dietary recall data were used to calculate the DI-GM (including components beneficial and unfavorable to gut microbiota). Multivariable weighted logistic and linear regression were employed to investigate the association of DI-GM with depression and total PHQ-9 score. The potential mediating role of phenotypic age and body mass index (BMI) was explored. Secondary analyses included subgroup analyses, restricted cubic spline (RCS), and multiple imputation.A higher DI-GM and beneficial gut microbiota score were associated with a lower prevalence of depression (DI-GM: OR = 0.94, 95% CI = 0.89, 0.99; beneficial gut microbiota score: OR = 0.88, 95% CI = 0.82, 0.94) and lower total PHQ-9 score (DI-GM: β=-0.09, 95% CI=-0.14, -0.04; beneficial gut microbiota: β=-0.15, 95% CI=-0.21, -0.08). RCS indicated a non-linear relationship between DI-GM and depression. A significant mediating effect of phenotypic age (proportion of mediation: 19.81%, 95% CI: 12.86-63.00%) and BMI (proportion of mediation: 16.49%, 95% CI: 12.87-62.00%) was observed.The newly proposed DI-GM was negatively associated with the prevalence of depression and total PHQ-9 score. Mediation analyses demonstrated a significant mediating effect of phenotypic age and BMI.",European archives of psychiatry and clinical neuroscience,2024,Xuan Zhang; Qinglong Yang; Jingtao Huang; Hanyuan Lin; Nan Luo; Haoxian Tang
