pmid,title,abstract,journal,year,authors
38875919,Antibiotic exposure and depression incidence: A cohort study of the Korean population.,"Recent research highlights the crucial role of the gut-brain axis in understanding depression etiologies. While burgeoning studies suggest an association between disruptions in gut microbiota and the development of depression, limited longitudinal studies have investigated this link. To address this gap, we conducted a retrospective cohort study using National Health Insurance Service-Health Screening Cohort (NHIS-HEALS) data in South Korea, involving 199,144 individuals aged 40-79. We examined the impact of cumulative antibiotic exposure (2004-2008) on subsequent depression incidence (2009-2013) by conducting Cox proportional hazards regressions. Our findings show an increasing depression risk with extended antibiotic exposure after adjusting for comorbidities and behavioral covariates. A broader antibiotic spectrum was associated with a higher depression risk. These trends persisted after adjusting for the original antibiotic indications. In conclusion, our study highlights the duration-dependent association between antibiotic exposure and increased depression risk, offering insights into depression etiologies and relevant novel therapeutic tools, and advocating for heightened antibiotic stewardship considering their impact on mental health.",Psychiatry research,2024,Jaewon Lee; Sun Jae Park; Seulggie Choi; Jooyoung Chang; Young Jun Park; Seogsong Jeong; Joung Sik Son; Gyeongsil Lee; Joseph C Ahn; Jihoon Andrew Kim; Sang Min Park
39125364,Maternal Fiber Intake and Perinatal Depression and Anxiety.,"(1) Background: Dietary fiber can significantly alter gut microbiota composition. The role of the gut microbiome in the Gut-Brain Axis and modulation of neuropsychiatric disease is increasingly recognized. The role of antenatal diet, particularly fiber intake, in mitigating maternal mental health disorders remains unexplored. The objective of this review is to investigate the association between maternal fiber intake and perinatal depression and anxiety (PDA). (2) Methods: A literature review of PubMed and Google Scholar was conducted using appropriate keyword/MeSH terms for pregnancy, diet, fiber, and mental health. Observational and clinical trials published between 2015 and 2021 were included and data pertaining to dietary patterns (DP), food intake, mental health, and demographic data were extracted. The top three fiber-containing food groups (FG) per study were identified using a sum rank scoring system of fiber per 100 g and fiber per serving size. The consumption of these top three fiber FGs was then ranked for each dietary pattern/group. Mental health outcomes for each study were simplified into three categories of improved, no change, and worsened. The relationship between top three fiber FGs consumed within each DP and mental health outcomes was analyzed using Spearman's correlation. (3) Results: Thirteen of fifty-two studies met the inclusion criteria. Ten (76.9%) studies assessed DPs (seven examined depression only, two examined depression and anxiety, and one examined anxiety only). Seven (53.9%) studies reported at least one significant positive relationship between mental health outcomes and DPs while three reported at least one negative outcome. Three (23.1%) studies compared intake of different food groups between depressed and non-depressed groups. In studies of DPs, the average consumption ranking of the top three fiber FGs bore a significant inverse association with mental health outcomes [r = -0.419 (95%CI: -0.672--0.078)] <i>p</i> = 0.015. In studies comparing the intake of different FGs between depressed and non-depressed groups, the consumption of top-ranking fiber foods was higher in the non-depressed groups, but significantly higher in four of the ten high fiber FGs. (4) Conclusions: This study reframes findings from previously published studies of maternal diet and mental health outcomes to focus on fiber intake specifically, using a fiber ranking system. A significant correlation between lower intake of fiber and poorer mental health outcomes warrants further investigation in future studies.",Nutrients,2024,Neda Ebrahimi; Tiffany Turner; Faith Gallant; Abinaa Chandrakumar; Roshni Kohli; Rebecca Lester; Victoria Forte; Kieran Cooley
38748594,Microbiota transplantation in restoring cesarean-related infant dysbiosis: a new frontier.,"C-section is crucial in reducing maternal and neonatal mortality when medically indicated, but one of its side effects could be the disruption of vertical transmission of maternal-infant microbiota during delivery, potentially leading to gut dysbiosis and increased disease risks in C-section infants. To address such dysbiosis, it seems reasonable to supplement ""what is missing"" during C-section procedure. This idea has prompted several clinical trials, including proof-of-concept, investigating interventions like vaginal microbial seeding, oral administration of maternal vaginal microbes and even oral administration of maternal fecal materials. Hereby, we have summarized these trials to help understand the current state of these researches, highlighting the predominantly pilot nature of most of these studies and emphasizing the need for well-designed studies with larger sample to guide evidence-based medicine in the future.",Gut microbes,2024,Sina Liu; Xiaoxia Luo; Lepeng Zhou; Ri-Hua Xie; Yan He
39187187,Is anxiety and depression transmissible? Depressed mother rats transmit anxiety- and depression-like phenotypes to cohabited rat pups through gut microbiota assimilation.,"This study is to investigate the role of gut microbiota transmission in the development of anxiety/depression in offspring exposed to maternal depression.Offspring rats were cohabitated with their depressed mother or father rats (which exposed to chronic unpredictable mild stress (CUMS)) for 2, 4, and 6 months, the anxiety- and depression-like behaviors, and interaction/caring activities between mother/father and their pups were detected. The gut microbiota composition and its relationship with behaviors were analyzed. Fecal microbiota transplantation (FMT) was performed to establish the gut microbiota of depressed/normal mother rats in the offspring rats to further confirm the role of ""depressive gut microbiota"" transmission in mediating the anxiety/depression in the pups.Anxiety and depression phenotypes can be transmitted from depressed mother rats to their cohabited offspring. Frequent interactions and gut microbiota assimilation were observed between rat mothers and their pups. Remodeling of the gut microbiota in pups by FMT could induce or attenuate anxiety- and depression-like phenotypes depending on the origin of the fecal microbiota. By comparison, the pups cohabiting with depressed father rats exhibited milder anxiety and depression.These data together support that depressed mothers can transmit anxiety/depression to their pups through gut microbiota assimilation, which is related to frequent interactions. Our study reinforces the significance of mental health of mothers in preventing the occurrence of childhood anxiety and depression, and pointing out the possibility of remodeling intestinal microbiota as an effective therapeutic approach for treating anxiety/depression in children.",Journal of affective disorders,2024,Huiliang Zhang; Hui Wei; Xuan Qin; Haiyue Song; Mengzhe Yang; Lun Zhang; Yi Liu; Zhuoqun Wang; Yiren Zhang; Yiwen Lai; Jiayu Yang; Yu Chen; Zhongshan Chen; Ji Zeng; Xiaochuan Wang; Rong Liu
39339649,Nutraceutical Capsules LL1 and Silymarin Supplementation Act on Mood and Sleep Quality Perception by Microbiota-Gut-Brain Axis: A Pilot Clinical Study.,"Stress, unhealthy lifestyle, and sleep disturbance worsen cognitive function in mood disorders, prompting a rise in the development of integrative health approaches. The recent investigations in the gut-brain axis field highlight the strong interplay among microbiota, inflammation, and mental health. Thus, this study aimed to investigate a new nutraceutical formulation comprising prebiotics, minerals, and silymarin's impact on microbiota, inflammation, mood, and sleep quality. The study evaluated the LL1 + silymarin capsule supplementation over 180 days in overweight adults. We analyzed the fecal gut microbiota using partial 16S rRNA sequences, measured cytokine expression via CBA, collected anthropometric data, quality of life, and sleep questionnaire responses, and obtained plasma samples for metabolic and hormonal analysis at baseline (T0) and 180 days (T180) post-supplementation. Our findings revealed significant reshaping in gut microbiota composition at the phylum, genus, and species levels, especially in the butyrate-producer bacteria post-supplementation. These changes in gut microbiota were linked to enhancements in sleep quality, mood perception, cytokine expression, and anthropometric measures which microbiota-derived short-chain fatty acids might enhance. The supplementation tested in this study seems to be able to improve microbiota composition, reflecting anthropometrics and inflammation, as well as sleep quality and mood improvement.",Nutrients,2024,Aline Boveto Santamarina; Victor Nehmi Filho; Jéssica Alves de Freitas; Lucas Augusto Moysés Franco; Joyce Vanessa Fonseca; Roberta Cristina Martins; José Antônio Orellana Turri; Bruna Fernanda Rio Branco da Silva; Arianne Fagotti Gusmão; Eloísa Helena Ribeiro Olivieri; José Pinhata Otoch; Ana Flávia Marçal Pessoa
39121711,The gut-microbiome in adult Attention-deficit/hyperactivity disorder - A Meta-analysis.,"Attention-deficit/hyperactivity disorder (ADHD) is a common neurodevelopmental condition that persists into adulthood in the majority of individuals. While the gut-microbiome seems to be relevant for ADHD, the few publications on gut-microbial alterations in ADHD are inconsistent, in the investigated phenotypes, sequencing method/region, preprocessing, statistical approaches, and findings. To identify gut-microbiome alterations in adult ADHD, robust across studies and statistical approaches, we harmonized bioinformatic pipelines and analyses of raw 16S rRNA sequencing data from four adult ADHD case-control studies (N<sub>ADHD</sub>=312, N<sub>NoADHD</sub>=305). We investigated diversity and differential abundance of selected genera (logistic regression and ANOVA-like Differential Expression tool), corrected for age and sex, and meta-analyzed the study results. Converging results were investigated for association with hyperactive/impulsive and inattentive symptoms across all participants. Beta diversity was associated with ADHD diagnosis but showed significant heterogeneity between cohorts, despite harmonized analyses. Several genera were robustly associated with adult ADHD; e.g., Ruminococcus_torques_group (LogOdds=0.17, p<sub>fdr</sub>=4.42 × 10<sup>-2</sup>), which was more abundant in adults with ADHD, and Eubacterium_xylanophilum_group (LogOdds= -0.12, p<sub>fdr</sub>=6.9 × 10<sup>-3</sup>), which was less abundant in ADHD. Ruminococcus_torques_group was further associated with hyperactivity/impulsivity symptoms and Eisenbergiella with inattention and hyperactivity/impulsivity (p<sub>fdr</sub><0.05). The literature points towards a role of these genera in inflammatory processes. Irreproducible results in the field of gut-microbiota research, due to between study heterogeneity and small sample sizes, stress the need for meta-analytic approaches and large sample sizes. While we robustly identified genera associated with adult ADHD, that might overall be considered beneficial or risk-conferring, functional studies are needed to shed light on these properties.",European neuropsychopharmacology : the journal of the European College of Neuropsychopharmacology,2024,Babette Jakobi; Priscilla Vlaming; Danique Mulder; Marta Ribases; Vanesa Richarte; Josep Antoni Ramos-Quiroga; Indira Tendolkar; Philip van Eijndhoven; Janna N Vrijsen; Jan Buitelaar; Barbara Franke; Martine Hoogman; Mirjam Bloemendaal; Alejandro Arias-Vasquez
39195546,Alterations in Vagal Tone Are Associated with Changes in the Gut Microbiota of Adults with Anxiety and Depression Symptoms: Analysis of Fecal Metabolite Profiles.,"Accumulating evidence suggests that interactions between the brain and gut microbiota significantly impact brain function and mental health. In the present study, we aimed to investigate whether young, healthy adults without psychiatric diagnoses exhibit differences in metabolic stool and microbiota profiles based on depression/anxiety scores and heart rate variability (HRV) parameters. Untargeted nuclear magnetic resonance-based metabolomics was used to identify fecal metabolic profiles. Results were subjected to multivariate analysis through principal component analysis (PCA) and partial least squares discriminant analysis (PLS-DA), and the metabolites were identified through VIP score. Metabolites separating asymptomatic and symptomatic groups were acetate, valine, and glutamate, followed by sugar regions, glutamine, acetone, valerate, and acetoacetate. The main metabolites identified in high vagal tone (HVT) and low vagal tone (LVT) groups were acetate, valerate, and glutamate, followed by propionate and butyrate. In addition to the metabolites identified by the PLS-DA test, significant differences in aspartate, sarcosine, malate, and methionine were observed between the groups. Levels of acetoacetate were higher in both symptomatic and LVT groups. Valerate levels were significantly increased in the symptomatic group, while isovalerate, propionate, glutamate, and acetone levels were significantly increased in the LVT group. Furthermore, distinct abundance between groups was only confirmed for the Firmicutes phylum. Differences between participants with high and low vagal tone suggest that certain metabolites are involved in communication between the vagus nerve and the brain.",Metabolites,2024,Laura Pasqualette; Tatiana Kelly da Silva Fidalgo; Liana Bastos Freitas-Fernandes; Gabriela Guerra Leal Souza; Luís Aureliano Imbiriba; Leandro Araujo Lobo; Eliane Volchan; Regina Maria Cavalcanti Pilotto Domingues; Ana Paula Valente; Karla Rodrigues Miranda
39247907,Modifications in the Composition of the Gut Microbiota in Rats Induced by Chronic Sleep Deprivation: Potential Relation to Mental Disorders.,"Sleep deprivation(SD) has numerous negative effects on mental health. A growing body of research has confirmed the implication of gut microbiota in mental disorders. However, the specific modifications in mammalian gut microbiota following SD exhibit variations across different studies.Male specific-pathogen-free Wistar rats were given a modified multiple-platform exposure for 7 days of SD. Fecal samples were obtained from the control and SD groups both at baseline and after 7 days of SD. We utilized 16S rDNA gene sequencing to investigate the gut microbial composition and functional pathways in rats.Analysis of the microbiota composition revealed a significant change in gut microbial composition after chronic SD, especially at the phylum level. The relative abundances of <i>p_Firmicutes, g_Romboutsia</i>, and <i>g_Enterococcus</i> increased, whereas those of <i>p_Bacteroidetes, p_Verrucomicrobia, p_Fusobacteria, g_Akkermansia</i>, and <i>g_Cetobacterium</i> decreased in animals after chronic SD compared with controls or animals before SD. The ratio of <i>Firmicutes</i> to <i>Bacteroidetes</i> exhibited an increase following SD. The relative abundance of gut microbiota related to the functional pathways of GABAergic and glutamatergic synapses was observed to be diminished in rats following SD compared to pre-SD.Collectively, these findings suggest that chronic SD causes significant alterations in both the structural composition and functional pathways of the gut microbiome. Further researches are necessary to investigate the chronological and causal connections among SD, the gut microbiota and mental disorders.",Nature and science of sleep,2024,Li-Ming Zheng; Yan Li
38852801,Levilactobacillus brevis SG031 modulates mood-related behaviors and attenuates stress-related sleep disturbance and autonomic dysfunction via gut microbiota modulation in Wistar-Kyoto rats.,"The probiotic bacterium Levilactobacillus brevis (L. brevis) has been proposed as a potential solution to manage mood disorders and alleviate stress-related sleep disturbances. However, the underlying mechanisms of its effects have not been fully elucidated. The aim of this study was to explore the impact and potential mechanisms of L. brevis SG031 supplementation on anxiety/depression-like behaviors and stress-induced changes in sleep patterns and sleep-related autonomic function.Male Wistar-Kyoto rats were administered low, medium, or high doses of L. brevis SG031 or a vehicle for 4 weeks, followed by behavioral tests to evaluate anxiety and depression. After an additional 2 weeks of SG031 or vehicle administration, a cage-exchange paradigm was performed with 24-hour physiological signal measurements under different stress conditions. Fecal samples were collected to construct a 16S rRNA library and assess fecal short-chain fatty acids (SCFAs).High-dose SG031 administration yielded reduced depression-like responses and enhanced social interaction in behavioral tests. It also exhibited a protective effect against stress-induced sleep disturbance characterized by decreased sleep time, increased awake time, and autonomic dysfunction during sleep. Fecal examination indicated that high-dose SG031 administration exerted beneficial effects on gut health by maintaining the gut microbial abundance, preserving stability of the microbial composition, and enriching the gut with SCFAs, which were associated with improvements in sleep and autonomic function.These findings collectively underscore the multifaceted potential of SG031 in addressing mental health and stress-related sleep challenges through the modulation of the gut microbiota.",Life sciences,2024,Chieh-Wen Chen; Hung-Chang Chen; Sheng-Chieh She; Chun-Ting Lai; Wei-Jen Chen; Terry B J Kuo; Cheryl C H Yang
38959253,Perturbations in gut microbiota composition in schizophrenia.,"Schizophrenia is a severe, complex and long-term psychiatric disorder with unclear etiology. Gut microbes influence the central nervous system via the gut-brain axis. Consequently, investigations of the relationship between gut microbes and schizophrenia are warranted. This study involved 29 patients with schizophrenia and 30 age-matched normal controls. After 16S rRNA gene sequencing and whole-genome shotgun metagenomic sequencing, we analyzed microbial diversity, composition, and function. According to 16S rRNA and metagenomic gene sequencing results, patients with schizophrenia had higher abundances of Clostridium and Megasphaera. Functional analysis showed that sphingolipid, phosphonates and phosphinates, as well as glutamine metabolism were associated with the occurrence and development of schizophrenia. Our data suggest that the gut microbiota exerts an effect on patients with schizophrenia, providing valuable insights into the potential regulation of in the context of this disorder.",PloS one,2024,YiMeng Wang; SiGuo Bi; XiaoLong Li; YuTao Zhong; DongDong Qi
39331265,Identification of hsa-miR-193a-5p-SURF4 axis related to the gut microbiota-metabolites- cytokines in lung cancer based on Mendelian randomization study and bioinformatics analysis.,"Lung cancer is a significant disease that affects people's physical and mental health. Currently, the treatment outcomes still do not meet clinical needs, and the causes of the disease are still unclear, therefore further exploration is needed.We analyzed the exposure factors of lung cancer, including gut microbiota, serum metabolites, and cytokines, through Mendelian randomization studies and bioinformatics analysis. We identified common SNPs and performed gene annotation, leading to the discovery of the key gene SURF4, which may affect the onset of lung cancer. We validated the oncogenic function and mechanism of SURF4 through public data analysis using GO and KEGG, and constructed a ceRNA network, revealing the lung cancer oncogenic pathway involving lncRNA/pseudogene-microRNA-SURF4.We first conducted a Mendelian randomization analysis on 418 gut microbiota, 1400 serum metabolites, and 41 cytokines in relation to lung cancer. We found that 16 gut microbiota, 29 serum metabolites, and 2 cytokines were closely associated with lung cancer. Further comparison of all differential SNPs revealed that rs550057 on chromosome 9 was a common SNP among these three exposure factors, indicating its crucial role in lung cancer formation. Through gene functional annotation using R language, we found that the expression of 15 genes, including SURF4, was influenced by rs550057. By querying these 15 genes from public databases for their differential expression and prognosis in lung cancer, we found significant differences in SURF4, MED22, and RPL7A. Furthermore, by querying the expression and correlation coefficients of upstream microRNAs of these three genes through the starBase website, we found that hsa-miR-193a-5p-SURF4 had the most significant effect on lung cancer. Through GO and KEGG analysis of SURF4-related genes, we identified the molecular pathways associated metabolic synthesis and microbial infection related to the promotion of lung cancer by SURF4. This validated the results of the previous Mendelian randomization study. Furthermore, we constructed a ceRNA network for SURF4 and identified two upstream differentially expressed pseudogenes and nine lncRNAs, confirming the functionality of the pseudogene/lncRNA-microRNA-SUFR4 pathway.In summary, we have elucidated the regulatory role of the pseudogene/lncRNA-microRNA-SUFR4 pathway in the progression of lung cancer, combining the research hotspots of gut microbiota-serum metabolites-cytokines. We have also confirmed the pathway and mechanism through SURF4 and its related genes promoting lung cancer formation. This may provide effective therapeutic methods for lung cancer and serve as a potential prognostic marker.",Discover oncology,2024,Jie Yu; Sibo Meng; Tiantian Xuan; Zhanmei Wang; Linli Qu; Fangli Cao; Jiaxin Li
39458509,Gut-Brain Axis and Psychopathology: Exploring the Impact of Diet with a Focus on the Low-FODMAP Approach.,"The gut-brain axis (GBA) is a bidirectional communication network connecting the central nervous system with the gastrointestinal (GI) tract, influencing both mental and physical health. Recent research has underscored the significant role of diet in modulating this axis, with attention to how specific dietary patterns can impact anxiety and depression, particularly when linked to disorders of gut-brain interaction (DGBIs), like intestinal bowel syndrome (IBS).This narrative review examines the effects of specific diet regimens on the GBA and its potential role in managing psychopathology, focusing on anxiety and depression, IBS, and the low-FODMAP diet. We conducted a search on PubMed and MEDLINE by combining the following key terms: ""Gut-Brain Axis"", ""Irritable Bowel Syndrome"", ""Low FODMAP diet"", ""Mediterranean Diet"", ""Psychopathology"", ""Anxiety and Depression"", and ""Gut Microbiota"". We applied the following filters: ""Clinical Trials"", ""Randomized Controlled Trials"", ""Reviews"", ""Meta-Analyses"", and ""Systematic Reviews"". In total, 59 papers were included.Low-FODMAP diet, originally developed to alleviate GI symptoms in IBS, may also positively influence mental health by modulating the GBA and improving the gut microbiota (GM) composition. New insights suggest that combining the low-FODMAP diet with the Mediterranean diet could offer a synergistic effect, enhancing both GI and psychological therapeutic outcomes.Understanding the complex interactions between diet, the GM, and mental health opens new avenues for holistic approaches to managing psychopathology, particularly when linked to GI symptoms.",Nutrients,2024,Emanuela Ribichini; Giulia Scalese; Chiara Mocci; Carola Severi
