pmid,title,abstract,journal,year,authors
35432038,The Oral-Microbiome-Brain Axis and Neuropsychiatric Disorders: An Anthropological Perspective.,"In the 21st century, neuropsychiatric disorders (NPDs) are on the rise, yet the causal mechanisms behind this global epidemic remain poorly understood. A key to these unknowns may lie within the vast communities of bacteria, fungi, and viruses in the body (microbiota), which are intimately linked with health and disease. NPDs were recently shown to be connected to gut microbiota, which can communicate with and influence the brain through the Gut-Brain-Axis (GBA). Parallel studies examining oral microbiota and their connections to the brain also suggest that microbes in the mouth can similarly influence NPD outcomes. However, the mechanisms and pathways that illuminate how oral microbiota and brain communicate in NPDs remain unknown. Here, we review identified mechanisms and pathways that oral microbiota use to engage the brain, and we lay the theoretical foundation for an oral-microbiota-brain axis (OMBA). Specifically, we examine established neuroinflammatory and immune system activation responses that underpin interactions between the oral microbiota and the central nervous system (CNS), detailing four specific mechanisms: (1) microbial and metabolite escape, (2) neuroinflammation, (3) CNS signaling, and (4) response to neurohormones. We then scrutinize why including the OMBA, in addition to the GBA, is critically needed to elucidate specific causal relationships between microbial dysbiosis and observed NPD development and progression. Furthermore, we argue for comprehensive, interdisciplinary approaches that integrate lab-based microbiome research and population-level studies that examine the OMBA to improve NPDs. We specifically identify key anthropological perspectives that integrate sociocultural, epidemiological, genetic, and environmental factors that shape the oral microbiome and its interactions with NPDs. Together, future studies of the OMBA in conjunction with interdisciplinary approaches can be used to identify NPD risks and improve outcomes, as well as develop novel intervention and treatment strategies.",Frontiers in psychiatry,2022,Grace B Bowland; Laura S Weyrich
36120376,Neferine alleviates chronic stress-induced depression by regulating monoamine neurotransmitter secretion and gut microbiota structure.,"Neferine (Nef) might possess anti-depressive properties; however, its therapeutic effects are yet to be elucidated. Therefore, in this study, we aimed to explore the anti-depressant property of Nef using a mouse model of chronic stress-induced depression. Fifteen depression-prone mice were randomly selected and divided into three groups, namely, the model, Nef, and fluoxetine (Flu) groups. We observed that in tail suspension and forced swimming tests, the Nef and Flu treatments significantly decreased the immobility time of the depressed mice, and increased their sucrose preference indices. Moreover, both Nef and Flu treatments induced significant increases in the levels of anti-depressant neurotransmitters, including dopamine (DA), serotonin (5-HT), and norepinephrine (NE), and also reduced pathological damage to the hippocampus of the depressed mice. Incidentally, Illumina MiSeq sequencing analysis demonstrated that the relative abundance of <i>Lactobacillus</i> in the intestinal microbiota of depressed mice was restored after Nef/Flu treatment. Moreover, colonic <i>Lactobacillus</i> abundance was positively correlated with the levels of DA, 5-HT, and NE in the hippocampus of the mice. In conclusion, Nef improved monoamine neurotransmitter secretion and modulated the intestinal flora structure, particularly the abundance of <i>Lactobacillus</i>. Hence, it showed considerable anti-depressant potential, and might be a prospective anti-depressant therapeutic agent.",Frontiers in pharmacology,2022,Zaiquan Dong; Qinglian Xie; Feiyu Xu; Xiaoling Shen; Yanni Hao; Jin Li; Haizhen Xu; Qiang Peng; Weihong Kuang
35286767,Potential of Probiotics as an Adjunct for Patients with Major Depressive Disorder.,"Major depressive disorder (MDD) is an enfeebling disease with a lifetime incidence of 20%. While accumulating studies implicate a correlation between the disease and gut microbiota, data show that not every patient responded to probiotic treatments. To comprehensively assess the potential role of probiotics in MDD, this study first summarizes the current pathological hypothesis of the disease from a life-stage perspective, focuses on the potential role of ""depression gut microbiota."" Currently available managements are then briefly summarized and novel bio-materials having potential therapeutic effects on MDD are also evaluated. To harness the positive effect of probiotics, prebiotics, and postbiotics, clinical evidence and their applications on MDD patients are listed. Factors that may counteract the pre/probiotic applications, such as diet, physiology, gender difference, and use of antibiotics and antidepressants are also discussed. The endocannabinoid (eCBs) system may be promising targets for probiotic therapy. More evidence is needed to demonstrate the hierarchical factors in the complex network driving the disease, and probiotic can be one promising adjunct for patients with MDD.",Molecular nutrition & food research,2022,Weihe Cang; Junrui Wu; Ruixue Ding; Weiming Wang; Na Li; Haisu Shi; Lin Shi; Yuankun Lee; Rina Wu
36078738,The Role of Psychobiotics to Ensure Mental Health during the COVID-19 Pandemic-A Current State of Knowledge.,"Psychobiotics are defined as probiotics, mainly of the genus <i>Lactobacillus</i> and <i>Bifidobacterium</i>, that confer mental health benefits to the host when consumed in a particular quantity through the interaction with commensal gut microbiota. The gut microbiota, which means a diverse and dynamic population of microorganisms harboring the gastrointestinal tract, communicates with the brain and vice versa through the brain-gut axis. The mechanisms of action of psychobiotics may be divided into four groups: synthesis of neurotransmitters and neurochemicals, regulation of the HPA axis, influence on the immune system, and synthesis of metabolites. Recent years showed that the COVID-19 pandemic affected not only physical, but also mental health. Social isolation, fear of infection, the lack of adequate vaccine, disinformation, increased number of deaths, financial loss, quarantine, and lockdown are all factors can cause psychiatric problems. The aim of this review was to discuss the potential role of psychobiotic in light of the current problems, based on <i>in vitro</i> and <i>in vivo</i> studies, meta-analyses, clinical trials evidence, and registered studies assessing probiotics' therapeutic administration in the prevention or treatment of symptoms or side effects of COVID-19.",International journal of environmental research and public health,2022,Dorota Zielińska; Marcelina Karbowiak; Aneta Brzezicka
35840611,The effects of probiotics on risk and time preferences.,"Animal models, human neuroimaging and lesion studies revealed that the gut microbiota can influence the interaction between the central and the enteric nervous systems via the gut-brain axis (GBA) and can affect brain regions linked to basic emotional and cognitive processes. The role of the gut microbiota in decision-making in healthy humans thus far remains largely unknown. Our study establishes a functional relationship between the gut microbiota and healthy humans' decisions that involve risk and time. We conducted a between subjects' placebo-controlled double-blinded design, with two groups and two sessions separated by 28 days, during which participants received daily doses of probiotics or a placebo. We investigated whether the prolonged and controlled intake of probiotics affects risk-taking behavior and intertemporal choices using incentivized economic tasks. We found a significant decrease in risk-taking behavior and an increase in future-oriented choices in the probiotics group as compared to the placebo group. These findings provide the first direct experimental evidence suggesting a potential functional role on the part of the microbiota-gut-brain axis in decision-making, creating a path for potential clinical applications and allowing for a better understanding of the underlying neural mechanisms of risk-taking behavior and intertemporal choices.",Scientific reports,2022,Aline M Dantas; Alexander T Sack; Elisabeth Bruggen; Peiran Jiao; Teresa Schuhmann
36329546,A critical analysis of eating disorders and the gut microbiome.,"The gut microbiota, also known as our ""second brain"" is an exciting frontier of research across a multitude of health domains. Gut microbes have been implicated in feeding behaviour and obesity, as well as mental health disorders including anxiety and depression, however their role in the development and maintenance of eating disorders (EDs) has only recently been considered. EDs are complex mental health conditions, shaped by a complicated interplay of factors. Perhaps due to an incomplete understanding of the etiology of EDs, treatment remains inadequate with affected individuals likely to face many relapses. The gut microbiota may be a missing piece in understanding the etiology of eating disorders, however more robust scientific inquiry is needed in the field before concrete conclusions can be made. In this spotlight paper, we critically evaluate what is known about the bi-directional relationship between gut microbes and biological processes that are implicated in the development and maintenance of EDs, including physiological functioning, hormones, neurotransmitters, the central nervous system, and the immune system. We outline limitations of current research, propose concrete steps to move the field forward and, hypothesize potential clinical implications of this research. Our gut is inhabited by millions of bacteria which have more recently been referred to as ""our second brain"". In fact, these microbes are thought to play a role in ED behaviour, associated anxiety and depression, and even affect our weight. Recent research has dove into this field with promising findings that have the potential to be applied clinically to improve ED recovery. The present paper discusses what is known about the gut microbiome in relation to EDs and the promising implications that leveraging this knowledge, through fecal microbiome transplants, probiotics, and microbiome-directed supplemental foods, could have on ED treatment.",Journal of eating disorders,2022,Sydney M Terry; Jacqueline A Barnett; Deanna L Gibson
36959989,Emerging Role and Place of Probiotics in the Management of Pediatric Neurodevelopmental Disorders.,"The current decade has witnessed significant developments with the latest therapeutic agents for managing various infectious diseases to complex hemato-oncological conditions, leading to a decrease in morbidity and mortality, while improving the quality of life (QoL), and increasing the life span. Non-communicable diseases (NCDs), which are on the rise across all age-groups, are being driven by unhealthy lifestyles and improved mental health issues. The current therapeutic agents were found to offer only symptomatic relief of varying efficacy and significant adverse effects, leading clinicians to evaluate other options for the management of both neurodevelopmental and neurodegenerative disorders. The role of gut microbiota has emerged as a potential target for the treatment of both neurodegenerative diseases and neurodevelopmental disorders like attention-deficit hyperactivity disorder (ADHD)/autism spectrum disorders (ASD) as a result of the decoding of the human genome and advances in our understanding of the human gut microbiome, including its interactions with the human brain. This review has been undertaken to understand on date level of understanding of human microbiota and towards identifying probiotic strains with proven efficacy and safety. According to recent investigations, several <i>lactobacillus</i> strains, including <i>L.</i> <i>Paracasei 37</i>, <i>L. Planetarium 128, L. reuteri DSM 17938</i>, and <i>Bifidobacterium longum</i>, have been effective in treating children's neurodevelopmental disorders such as ASD and ADHD. Future clinical studies are nonetheless required to confirm the long-term safety and effectiveness of probiotic strains in managing the primary and comorbid symptoms, hence improving patient and family quality of life.Khanna HN, Roy S, Shaikh A, <i>et al.</i> Emerging Role and Place of Probiotics in the Management of Pediatric Neurodevelopmental Disorders. Euroasian J Hepato-Gastroenterol 2022;12(2):102-108.",Euroasian journal of hepato-gastroenterology,2022,Himani Narula Khanna; Sushovan Roy; Aqsa Shaikh; Viswanath Bandi
35731901,"The clinical and mechanistic roles of bile acids in depression, Alzheimer's disease, and stroke.","The burden of neurological and neuropsychiatric disorders continues to grow with significant impacts on human health and social economy worldwide. Increasing clinical and preclinical evidences have implicated that bile acids (BAs) are involved in the onset and progression of neurological and neuropsychiatric diseases. Here, we summarized recent studies of BAs in three types of highly prevalent brain disorders, depression, Alzheimer's disease, and stroke. The shared and specific BA profiles were explored and potential markers associated with disease development and progression were summarized. The mechanistic roles of BAs were reviewed with focuses on inflammation, gut-brain-microbiota axis, cellular apoptosis. We also discussed future perspectives for the prevention and treatment of neurological and neuropsychiatric disorders by targeting BAs and related molecules and gut microbiota. Our understanding of BAs and their roles in brain disorders is still evolving. A large number of questions still need to be addressed on the emerging crosstalk among central, peripheral, intestine, and their contribution to brain and mental health.",Proteomics,2022,Wu Lirong; Zhao Mingliang; Li Mengci; Guo Qihao; Ren Zhenxing; Zheng Xiaojiao; Chen Tianlu
35779628,(R)-ketamine as prophylactic and therapeutic drug for neurological disorders: Beyond depression.,"Neurological disorders are the leading cause of disability and the second leading cause of death worldwide. The increasing social and economic burdens of neurological disorders are driven by global population growth and aging. Depression is a common psychiatric symptom in numerous neurological disorders. It is also a risk factor for Alzheimer's disease (AD) and other dementias, Parkinson's disease (PD), and stroke. The rapid-acting and sustained antidepressant actions of (R,S)-ketamine for severe depression was accidentally discovered. Interestingly, (R)-ketamine has greater potency and longer-lasting antidepressant-like effects than (S)-ketamine in rodents. Importantly, its side effects in rodents and humans are lower than those of (R,S)-ketamine and (S)-ketamine. Furthermore, (R)-ketamine could elicit beneficial actions in various rodent models of neurological disorders, including PD, multiple sclerosis (MS), and stroke. In this article, we review the potential of (R)-ketamine as a prophylactic or therapeutic drug for neurological disorders including AD and other dementias, PD, MS, and stroke.",Neuroscience and biobehavioral reviews,2022,Xingming Wang; Jianjun Yang; Kenji Hashimoto
36104346,"Maternal immune activation induces autism-like changes in behavior, neuroinflammatory profile and gut microbiota in mouse offspring of both sexes.","Autism Spectrum Disorder (ASD) is a sex-biased neurodevelopmental disorder with a male to female prevalence of 4:1, characterized by persistent deficits in social communication and interaction and restricted-repetitive patterns of behavior, interests or activities. Microbiota alterations as well as signs of neuroinflammation have been also reported in ASD. The involvement of immune dysregulation in ASD is further supported by evidence suggesting that maternal immune activation (MIA), especially during early pregnancy, may be a risk factor for ASD. The present study was aimed at characterizing the effects of MIA on behavior, gut microbiota and neuroinflammation in the mouse offspring also considering the impact of MIA in the two sexes. MIA offspring exhibited significant ASD-like behavioral alterations (i.e., deficits in sociability and sensorimotor gating, perseverative behaviors). The analysis of microbiota revealed changes in specific microbial taxa that recapitulated those seen in ASD children. In addition, molecular analyses indicated sex-related differences in the neuroinflammatory responses triggered by MIA, with a more prominent effect in the cerebellum. Our data suggest that both sexes should be included in the experimental designs of preclinical studies in order to identify those mechanisms that confer different vulnerability to ASD to males and females.",Translational psychiatry,2022,Anna Maria Tartaglione; Annacandida Villani; Maria Antonietta Ajmone-Cat; Luisa Minghetti; Laura Ricceri; Valerio Pazienza; Roberta De Simone; Gemma Calamandrei
36191590,Features of gut microbiota in patients with anorexia nervosa.,"Anorexia nervosa (AN) is a psychological disorder, which is characterized by the misunderstanding of body image, food restriction, and low body weight. An increasing number of studies have reported that the pathophysiological mechanism of AN might be associated with the dysbiosis of gut microbiota. The purpose of our study was to explore the features of gut microbiota in patients with AN, hoping to provide valuable information on its pathogenesis and treatment.In this cross-sectional study, from August 2020 to June 2021, patients with AN who were admitted into Peking University Third Hospital and Peking University Sixth Hospital ( n   =  30) were recruited as the AN group, and healthy controls (HC) were recruited from a middle school and a university in Beijing ( n   =  30). Demographic data, Hamilton Depression Scale (HAMD) scores of the two groups, and length of stay of the AN group were recorded. Microbial diversity analysis of gut microbiota in stool samples from the two groups was analyzed by 16S ribosomal RNA (rRNA) gene sequencing.The weight (AN vs. HC, [39.31 ± 7.90] kg vs. [56.47 ± 8.88] kg, P  < 0.001) and body mass index (BMI, AN vs. HC, [14.92 ± 2.54] kg/m 2vs. [20.89 ± 2.14] kg/m 2 , P  < 0.001) of patients with AN were statistically significantly lower than those of HC, and HAMD scores in AN group were statistically significantly higher than those of HC. For alpha diversity, there were no statistically significant differences between the two groups; for beta diversity, the two groups differed obviously regarding community composition. Compared to HC, the proportion of Lachnospiraceae in patients with AN was statistically significantly higher (AN vs. HC, 40.50% vs. 31.21%, Z  = -1.981, P  = 0.048), while that of Ruminococcaceae was lower (AN vs. HC, 12.17% vs. 19.15%, Z  = -2.728, P  = 0.007); the proportion of Faecalibacterium (AN vs. HC, 3.97% vs. 9.40%, Z  = -3.638, P  < 0.001) and Subdoligranulum (AN vs. HC, 4.60% vs. 7.02%, Z  = -2.369, P  = 0.018) were statistically significantly lower, while that of Eubacterium_hallii_group was significantly higher (AN vs. HC, 7.63% vs. 3.43%, Z  = -2.115, P  = 0.035). Linear discriminant effect (LEfSe) analysis (LDA score >3.5) showed that o_Lachnospirales, f_Lachnospiraceae, and g_Eubacterium_hallii_group (o, f and g represents order, family and genus respectively) were enriched in patients with AN. Microbial function of nutrient transport and metabolism in AN group were more abundant ( P  > 0.05). In AN group, weight and BMI were significantly negatively correlated with the abundance of Bacteroidota and Bacteroides , while positively correlated with Subdoligranulum . BMI was significantly positively correlated with Firmicutes; HAMD scores were significantly negatively correlated with Faecalibacterium.The composition of gut microbiota in patients with AN was different from that of healthy people. Clinical indicators have correlations with the abundance of gut microbiota in patients with AN.",Chinese medical journal,2022,Runxue Yuan; Lei Yang; Gaiqi Yao; Shuxia Geng; Qinggang Ge; Shining Bo; Xueni Li
35711580,Schizophrenia Patients With Prevotella-Enterotype Have a Higher Risk of Obesity.,"Recent studies have indicated the critical influence of gut microbiota on the occurrence of obesity. There is a significant risk of obesity in people with schizophrenia. This work proposed that the disorder of gut microbiota in patients with schizophrenia was based on microbial enterotypes. Ninety-seven patients with schizophrenia and 69 matched health controls were eligible. The fresh feces of all the subjects were collected and used to complete 16S rRNA sequence. Statistical analysis was performed to identify the intestinal type of gut microbiota and analyze their potential effects on metabolic function. The patients with enterotype-P had a higher BMI than that of the others. Several differences in the gut microbes of enterotype-P were found between the patients and the controls. Proteobacteria and Firmicutes had significantly higher abundance in the patients' group with enterotype-P. The Bacteroidetes had higher abundance in health controls with enterotype-P. Different metabolic pathways of the microbiota with the enterotype-P were identified in the subjects categorized in different BMI intervals. The schizophrenia patients had a significantly higher BMI than that of health controls. The patients with enterotype-P had a higher BMI. Therefore, the enterotype-P might have a critical influence on a variety of metabolic pathways to disturb the metabolism of glucose and lipid in human body.",Frontiers in psychiatry,2022,Ying Liang; Yang Shen; Gaofei Li; Ye Yuan; Meng Zhang; Jiayu Gao
35956395,Positive Effects of α-Lactalbumin in the Management of Symptoms of Polycystic Ovary Syndrome.,"To date, the involvement of α-Lactalbumin (α-LA) in the management of polycystic ovary syndrome (PCOS) refers to its ability to improve intestinal absorption of natural molecules like inositols, overcoming the inositol resistance. However, due to its own aminoacidic building blocks, α-LA is involved in various biological processes that can open new additional applications. A great portion of women with PCOS exhibit gastrointestinal dysbiosis, which is in turn one of the triggering mechanisms of the syndrome. Due to its prebiotic effect, α-LA can recover dysbiosis, also improving the insulin resistance, obesity and intestinal inflammation frequently associated with PCOS. Further observations suggest that altered gut microbiota negatively influence mental wellbeing. Depressive mood and low serotonin levels are indeed common features of women with PCOS. Thanks to its content of tryptophan, which is the precursor of serotonin, and considering the strict link between gut and brain, using α-LA contributes to preserving mental well-being by maintaining high levels of serotonin. In addition, considering women with PCOS seeking pregnancy, both altered microbiota and serotonin levels can induce later consequences in the offspring. Therefore, a deeper knowledge of potential applications of α-LA is required to transition to preclinical and clinical studies extending its therapeutic advantages in PCOS.",Nutrients,2022,Vincenzo Cardinale; Elisa Lepore; Sabrina Basciani; Salvatore Artale; Maurizio Nordio; Mariano Bizzarri; Vittorio Unfer
36558556,The Effect of Breast Milk Microbiota on the Composition of Infant Gut Microbiota: A Cohort Study.,"Evidence shows that breast milk microbiota and an infant’s gut microbiota are related. This study aimed to compare the effects of breast milk microbiota on the construction and colonization of gut microbiota in newborns. In this study, 23 healthy infants were selected and divided into a breastfeeding group (13) and a mixed feeding group (10) based on the feeding method within one month of age. Infant fecal and breast milk samples were collected on the day of birth (0 day) and 30 days after birth (30 days) for 16S rRNA second-generation sequencing and SCFA detection. The results showed that Firmicutes and Actinobacteriota on day 0 and Firmicutes and Proteobacteria on 30 d dominated breast milk gut microbiota. There were correlations between the breast milk microbiota and the infant gut microbiota in each group (p < 0.05). Additionally, breast milk microbiota correlated more significantly with infants’ SCFAs in the breastfeeding group than in the mixed feeding group. This study showed that breast milk microbiota partially influences the construction of infant gut microbiota, with some key strains having a crucial influence, such as Lactobacillus, Bifidobacterium, and Enterobacter. However, the effect of breast milk microbiota on infant gut microbiota is not through direct strain transmission but has been indirectly influenced, which may be related to the cross-feeding effect mediated by SCFAs.",Nutrients,2022,Yapeng Li; Lei Ren; Yunyi Wang; Jinxing Li; Qingqing Zhou; Chenrui Peng; Yuchen Li; Ruyue Cheng; Fang He; Xi Shen
