pmid,title,abstract,journal,year,authors
35855338,Effects of Ketogenic Diet on Neuroinflammation in Neurodegenerative Diseases.,"The ketogenic diet (KD) is a low-carbohydrate, high-fat and adequate-protein diet. As a diet mimicking fasting, it triggers the production of ketone bodies (KBs) and brings the body into a state of ketosis. Recent and accumulating studies on humans and animal models have shown that KD is beneficial to neurodegenerative diseases through modulating central and peripheral metabolism, mitochondrial function, inflammation, oxidative stress, autophagy, and the gut microbiome. Complicated interplay of metabolism, gut microbiome, and other mechanisms can regulate neuroinflammation in neurodegenerative diseases by activating multiple molecular and cellular pathways. In this review, we detail the physiological basis of the KD, its functions in regulating neuroinflammation, and its protective role in normal brain aging and neurodegenerative diseases, such as Alzheimer's disease (AD), Parkinson's disease (PD), amyotrophic lateral sclerosis (ALS), and Huntington's disease (HD). We aimed to elucidate the underlying neuroinflammatory mechanisms of KD therapies in neurodegenerative diseases and provide novel insights into their application for neurodegenerative disease prevention and treatment.",Aging and disease,2022,Ziying Jiang; Xi Yin; Miao Wang; Tong Chen; Yuanyuan Wang; Zhongbao Gao; Zhenfu Wang
35798742,Oral and gut dysbiosis leads to functional alterations in Parkinson's disease.,"Although several studies have identified a distinct gut microbial composition in Parkinson's disease (PD), few studies have investigated the oral microbiome or functional alteration of the microbiome in PD. We aimed to investigate the connection between the oral and gut microbiome and the functional changes in the PD-specific gut microbiome using shotgun metagenomic sequencing. The taxonomic composition of the oral and gut microbiome was significantly different between PD patients and healthy controls (P = 0.003 and 0.001, respectively). Oral Lactobacillus was more abundant in PD patients and was associated with opportunistic pathogens in the gut (FDR-adjusted P < 0.038). Functional analysis revealed that microbial gene markers for glutamate and arginine biosynthesis were downregulated, while antimicrobial resistance gene markers were upregulated in PD patients than healthy controls (all P < 0.001). We identified a connection between the oral and gut microbiota in PD, which might lead to functional alteration of the microbiome in PD.",NPJ Parkinson's disease,2022,Sungyang Jo; Woorim Kang; Yun Su Hwang; Seung Hyun Lee; Kye Won Park; Mi Sun Kim; Hyunna Lee; Hyung Jeong Yoon; Yoo Kyoung Park; Mauricio Chalita; Je Hee Lee; Hojun Sung; Jae-Yun Lee; Jin-Woo Bae; Sun Ju Chung
35786740,Gut instincts in neuroimmunity from the eighteenth to twenty-first centuries.,"In the past two decades, work on the microbiota-gut-brain axis has led to a renewed appreciation for the interconnectedness between body systems in both clinical and scientific circles. In the USA alone, millions of adults are burdened with non-communicable chronic diseases whose putative etiologies were previously thought to be restricted to either the gut or brain, such as inflammatory bowel disease, irritable bowel syndrome, Parkinson's and Alzheimer's disease, and autism spectrum disorder. However, the recent explosion of research into the impacts of the gut microbiome on diverse aspects of human health has revealed the potentially critical importance of reciprocal interactions between the gut microbiota, the immune system, and the brain in diverse diseases and disorders. In this review, we revisit the history of gut-brain interactions in science and medicine, which dates back to at least the eighteenth century, and outline how concepts in this field have shifted and evolved across eras. Next, we highlight the modern resurgence of gut-brain axis research, focusing on neuro-immune-microbiota interactions and recent progress towards a mechanistic understanding of the diverse impacts of the microbiome on human health. Finally, we offer a forward-looking perspective on the future of microbiota-gut-brain research, which may eventually reveal new paths towards the treatment of diverse diseases influenced by the complex connections between the microbiota and the brain.",Seminars in immunopathology,2022,Mytien Nguyen; Noah W Palm
35743072,PARK7/DJ-1 as a Therapeutic Target in Gut-Brain Axis Diseases.,"It is increasingly known that Parkinson's (PD) and Alzheimer's (AD) diseases occur more frequently in patients with inflammatory gastrointestinal diseases including inflammatory bowel (IBD) or celiac disease, indicating a pathological link between them. Although epidemiological observations suggest the existence of the gut-brain axis (GBA) involving systemic inflammatory and neural pathways, little is known about the exact molecular mechanisms. Parkinson's disease 7 (PARK7/DJ-1) is a multifunctional protein whose protective role has been widely demonstrated in neurodegenerative diseases, including PD, AD, or ischemic stroke. Recent studies also revealed the importance of PARK7/DJ-1 in the maintenance of the gut microbiome and also in the regulation of intestinal inflammation. All these findings suggest that PARK7/DJ-1 may be a link and also a potential therapeutic target in gut and brain diseases. In this review, therefore, we discuss our current knowledge about PARK7/DJ-1 in the context of GBA diseases.",International journal of molecular sciences,2022,Domonkos Pap; Apor Veres-Székely; Beáta Szebeni; Ádám Vannay
35723531,Bacterial Butyrate in Parkinson's Disease Is Linked to Epigenetic Changes and Depressive Symptoms.,"The gut microbiome and its metabolites can impact brain health and are altered in Parkinson's disease (PD) patients. It has been recently demonstrated that PD patients have reduced fecal levels of the potent epigenetic modulator butyrate and its bacterial producers.Here, we investigate whether the changes in the gut microbiome and associated metabolites are related to PD symptoms and epigenetic markers in leucocytes and neurons.Stool, whole blood samples, and clinical data were collected from 55 PD patients and 55 controls. We performed DNA methylation analysis on whole blood samples and analyzed the results in relation to fecal short-chain fatty acid concentrations and microbiota composition. In another cohort, prefrontal cortex neurons were isolated from control and PD brains. We identified genome-wide DNA methylation by targeted bisulfite sequencing.We show that lower fecal butyrate and reduced counts of genera Roseburia, Romboutsia, and Prevotella are related to depressive symptoms in PD patients. Genes containing butyrate-associated methylation sites include PD risk genes and significantly overlap with sites epigenetically altered in PD blood leucocytes, predominantly neutrophils, and in brain neurons, relative to controls. Moreover, butyrate-associated methylated-DNA regions in PD overlap with those altered in gastrointestinal (GI), autoimmune, and psychiatric diseases.Decreased levels of bacterially produced butyrate are related to epigenetic changes in leucocytes and neurons from PD patients and to the severity of their depressive symptoms. PD shares common butyrate-dependent epigenetic changes with certain GI and psychiatric disorders, which could be relevant for their epidemiological relation. © 2022 The Authors. Movement Disorders published by Wiley Periodicals LLC on behalf of International Parkinson and Movement Disorder Society.",Movement disorders : official journal of the Movement Disorder Society,2022,Aoji Xie; Elizabeth Ensink; Peipei Li; Juozas Gordevičius; Lee L Marshall; Sonia George; John Andrew Pospisilik; Velma T E Aho; Madelyn C Houser; Pedro A B Pereira; Knut Rudi; Lars Paulin; Malú G Tansey; Petri Auvinen; Patrik Brundin; Lena Brundin; Viviane Labrie; Filip Scheperjans
35722294,"Integrated Microbiome and Host Transcriptome Profiles Link Parkinson's Disease to <i>Blautia</i> Genus: Evidence From Feces, Blood, and Brain.","A link between the gut microbiome and Parkinson's disease (PD) has been intensively studied, and more than 100 differential genera were identified across the studies. However, the predominant genera contributing to PD remain poorly understood. Inspired by recent advances showing microbiota distribution in the blood and brain, we, here, comprehensively investigated currently available fecal microbiome data (1,914 samples) to identify significantly altered genera, which were further validated by comparison to the results from microbiome analysis of blood (85 samples) and brain (268 samples). Our data showed that the composition of fecal microbiota was different from that of blood and brain. We found that <i>Blautia</i> was the unique genus consistently depleted across feces, blood, and brain samples of PD patients (<i>P</i> < 0.05), despite using rigorous criteria to remove contaminants. Moreover, enrichment analyses revealed that host genes correlated with <i>Blautia</i> genus abundance were mainly involved in mitochondrial function and energy metabolism, and mapped to neurodegenerative diseases (NDDs) and metabolic diseases. A random forest classifier constructed with fecal microbiota data demonstrated that <i>Blautia</i> genus was an important feature contributing to discriminating PD patients from controls [receiver operating characteristic (ROC)-area under curve (AUC) = 0.704, precision-recall curve (PRC)-AUC = 0.787]. Through the integration of microbiome and transcriptome, our study depicted microbial profiles in the feces, blood, and brain of PD patients, and identified <i>Blautia</i> genus as a potential genus linked to PD. Further studies are greatly encouraged to determine the role of <i>Blautia</i> genus in the pathogenesis of PD.",Frontiers in microbiology,2022,Xingzhi Guo; Peng Tang; Chen Hou; Li Chong; Xin Zhang; Peng Liu; Li Chen; Yue Liu; Lina Zhang; Rui Li
35708472,Neuroinflammation: A Distal Consequence of Periodontitis.,"Periodontitis, a chronic, inflammatory disease, induces systemic inflammation and contributes to the development of neurodegenerative diseases. The precise etiology of the most common neurodegenerative disorders, such as sporadic Alzheimer's, Parkinson's diseases and multiple sclerosis (AD, PD, and MS, respectively), remains to be revealed. Chronic neuroinflammation is a well-recognized component of these disorders, and evidence suggests that systemic inflammation is a possible stimulus for neuroinflammation development. Systemic inflammation can lead to deleterious consequences on the brain if the inflammation is sufficiently severe or if the brain shows vulnerabilities due to genetic predisposition, aging, or neurodegenerative diseases. It has been proposed that periodontal disease can initiate or contribute to the AD pathogenesis through multiple pathways, including key periodontal pathogens. Dysbiotic oral bacteria can release bacterial products into the bloodstream and eventually cross the brain-blood barrier; these bacteria can also cause alterations to gut microbiota that enhance inflammation and potentially affect brain function via the gut-brain axis. The trigeminal nerve has been suggested as another route for connecting oral bacterial products to the brain. PD and MS are often preceded by gastrointestinal symptoms or aberrant gut microbiome composition, and alterations in the enteric nervous system accompany the disease. Clinical evidence has suggested that patients with periodontitis are at a higher risk of developing PD and MS. This nexus among the brain, periodontal disease, and systemic inflammation heralds new ways in which microglial cells, the main innate immune cells, and astrocytes, the crucial regulators of innate and adaptive immune responses in the brain, contribute to brain pathology. Currently, the lack of understanding of the pathogenesis of neurodegeneration is hindering treatment development. However, we may prevent this pathogenesis by tackling one of its possible contributors (periodontitis) for systemic inflammation through simple preventive oral hygiene measures.",Journal of dental research,2022,X Li; M Kiprowska; T Kansara; P Kansara; P Li
35674870,Neurodegeneration and Neuroinflammation in Parkinson's Disease: a Self-Sustained Loop.,"Neuroinflammation plays a significant role in Parkinson's disease (PD) etiology along with mitochondrial dysfunction and impaired proteostasis. In this context, mechanisms related to immune response can act as modifiers at different steps of the neurodegenerative process and justify the growing interest in anti-inflammatory agents as potential disease-modifying treatments in PD. The discovery of inherited gene mutations in PD has allowed researchers to develop cellular and animal models to study the mechanisms of the underlying biology, but the original cause of neuroinflammation in PD is still debated to date.Cell autonomous alterations in neuronal cells, including mitochondrial damage and protein aggregation, could play a role, but recent findings also highlighted the importance of intercellular communication at both local and systemic level. This has given rise to debate about the role of non-neuronal cells in PD and reignited intense research into the gut-brain axis and other non-neuronal interactions in the development of the disease. Whatever the original trigger of neuroinflammation in PD, what appears quite clear is that the aberrant activation of glial cells and other components of the immune system creates a vicious circle in which neurodegeneration and neuroinflammation nourish each other. In this review, we will provide an up-to-date summary of the main cellular alterations underlying neuroinflammation in PD, including those induced by environmental factors (e.g. the gut microbiome) and those related to the genetic background of affected patients. Starting from the lesson provided by familial forms of PD, we will discuss pathophysiological mechanisms linked to inflammation that could also play a role in idiopathic forms. Finally, we will comment on the potential clinical translatability of immunobiomarkers identified in PD patient cohorts and provide an update on current therapeutic strategies aimed at overcoming or preventing inflammation in PD.",Current neurology and neuroscience reports,2022,G Arena; K Sharma; G Agyeah; R Krüger; A Grünewald; J C Fitzgerald
35656540,The Gut Microbiome in Parkinson's Disease: A Longitudinal Study of the Impacts on Disease Progression and the Use of Device-Assisted Therapies.,"Altered gut microbiome (GM) composition has been established in Parkinson's disease (PD). However, few studies have longitudinally investigated the GM in PD, or the impact of device-assisted therapies.To investigate the temporal stability of GM profiles from PD patients on standard therapies and those initiating device-assisted therapies (DAT) and define multivariate models of disease and progression.We evaluated validated clinical questionnaires and stool samples from 74 PD patients and 74 household controls (HCs) at 0, 6, and 12 months. Faster or slower disease progression was defined from levodopa equivalence dose and motor severity measures. 19 PD patients initiating Deep Brain Stimulation or Levodopa-Carbidopa Intestinal Gel were separately evaluated at 0, 6, and 12 months post-therapy initiation.Persistent underrepresentation of short-chain fatty-acid-producing bacteria, <i>Butyricicoccus, Fusicatenibacter, Lachnospiraceae ND3007 group</i>, and <i>Erysipelotrichaceae UCG-003</i>, were apparent in PD patients relative to controls. A sustained effect of DAT initiation on GM associations with PD was not observed. PD progression analysis indicated that the genus <i>Barnesiella</i> was underrepresented in faster progressing PD patients at <i>t</i> = 0 and <i>t</i> = 12 months. Two-stage predictive modeling, integrating microbiota abundances and nutritional profiles, improved predictive capacity (change in Area Under the Curve from 0.58 to 0.64) when assessed at Amplicon Sequence Variant taxonomic resolution.We present longitudinal GM studies in PD patients, showing persistently altered GM profiles suggestive of a reduced butyrogenic production potential. DATs exerted variable GM influences across the short and longer-term. We found that specific GM profiles combined with dietary factors improved prediction of disease progression in PD patients.",Frontiers in aging neuroscience,2022,Michal Lubomski; Xiangnan Xu; Andrew J Holmes; Samuel Muller; Jean Y H Yang; Ryan L Davis; Carolyn M Sue
35654142,Mechanistic insights into accelerated α-synuclein aggregation mediated by human microbiome-associated functional amyloids.,"The gut microbiome has been shown to have key implications in the pathogenesis of Parkinson's disease (PD). The Escherichia coli functional amyloid CsgA is known to accelerate α-synuclein aggregation in vitro and induce PD symptoms in mice. However, the mechanism governing CsgA-mediated acceleration of α-synuclein aggregation is unclear. Here, we show that CsgA can form stable homodimeric species that correlate with faster α-synuclein amyloid aggregation. Furthermore, we identify and characterize new CsgA homologs encoded by bacteria present in the human microbiome. These CsgA homologs display diverse aggregation kinetics, and they differ in their ability to modulate α-synuclein aggregation. Remarkably, we demonstrate that slowing down CsgA aggregation leads to an increased acceleration of α-synuclein aggregation, suggesting that the intrinsic amyloidogenicity of gut bacterial CsgA homologs affects their ability to accelerate α-synuclein aggregation. Finally, we identify a complex between CsgA and α-synuclein that functions as a platform to accelerate α-synuclein aggregation. Taken together, our work reveals complex interplay between bacterial amyloids and α-synuclein that better informs our understanding of PD causation.",The Journal of biological chemistry,2022,Sujeet S Bhoite; Yilin Han; Brandon T Ruotolo; Matthew R Chapman
35645785,Nutritional Intake and Gut Microbiome Composition Predict Parkinson's Disease.,"Models to predict Parkinson's disease (PD) incorporating alterations of gut microbiome (GM) composition have been reported with varying success.To assess the utility of GM compositional changes combined with macronutrient intake to develop a predictive model of PD.We performed a cross-sectional analysis of the GM and nutritional intake in 103 PD patients and 81 household controls (HCs). GM composition was determined by 16S amplicon sequencing of the V3-V4 region of bacterial ribosomal DNA isolated from stool. To determine multivariate disease-discriminant associations, we developed two models using Random Forest and support-vector machine (SVM) methodologies.Using updated taxonomic reference, we identified significant compositional differences in the GM profiles of PD patients in association with a variety of clinical PD characteristics. Six genera were overrepresented and eight underrepresented in PD patients relative to HCs, with the largest difference being overrepresentation of <i>Lactobacillaceae</i> at family taxonomic level. Correlation analyses highlighted multiple associations between clinical characteristics and select taxa, whilst constipation severity, physical activity and pharmacological therapies associated with changes in beta diversity. The random forest model of PD, incorporating taxonomic data at the genus level and carbohydrate contribution to total energy demonstrated the best predictive capacity [Area under the ROC Curve (AUC) of 0.74].The notable differences in GM diversity and composition when combined with clinical measures and nutritional data enabled the development of a predictive model to identify PD. These findings support the combination of GM and nutritional data as a potentially useful biomarker of PD to improve diagnosis and guide clinical management.",Frontiers in aging neuroscience,2022,Michal Lubomski; Xiangnan Xu; Andrew J Holmes; Samuel Muller; Jean Y H Yang; Ryan L Davis; Carolyn M Sue
35610236,Probiotics synergized with conventional regimen in managing Parkinson's disease.,"Parkinson's disease (PD) is mainly managed by pharmacological therapy (e.g., Benserazide and dopamine agonists). However, prolonged use of these drugs would gradually diminish their dopaminergic effect. Gut dysbiosis was observed in some patients with PD, suggesting close association between the gut microbiome and PD. Probiotics modulate the host's gut microbiota beneficially. A 3-month randomized, double-blind, placebo-controlled clinical trial was conducted to investigate the beneficial effect of probiotic co-administration in patients with PD. Eighty-two PD patients were recruited and randomly divided into probiotic [n = 48; Bifidobacterium animalis subsp. lactis Probio-M8 (Probio-M8), Benserazide, dopamine agonists] and placebo (n = 34; placebo, Benserazide, dopamine agonists) groups. Finally, 45 and 29 patients from Probio-M8 and placebo groups provided complete fecal and serum samples for further omics analysis, respectively. The results showed that Probio-M8 co-administration conferred added benefits by improving sleep quality, alleviating anxiety, and gastrointestinal symptoms. Metagenomic analysis showed that, after the intervention, there were significantly more species-level genome bins (SGBs) of Bifidobacterium animalis, Ruminococcaceae, and Lachnospira, while less Lactobacillus fermentum and Klebsiella oxytoca in Probio-M8 group (P < 0.05). Interestingly, Lactobacillus fermentum correlated positively with the scores of UPDRS-III, HAMA, HAMD-17, and negatively with MMSE. Klebsiella oxytoca correlated negatively with feces hardness. Moreover, co-administering Probio-M8 increased SGBs involved in tryptophan degradation, gamma-aminobutyric acid, short-chain fatty acids, and secondary bile acid biosynthesis, as well as serum acetic acid and dopamine levels (P < 0.05). Taken together, Probio-M8 synergized with the conventional regimen and strengthened the clinical efficacy in managing PD, accompanied by modifications of the host's gut microbiome, gut microbial metabolic potential, and serum metabolites.",NPJ Parkinson's disease,2022,Hairong Sun; Feiyan Zhao; Yuanyuan Liu; Teng Ma; Hao Jin; Keyu Quan; Bing Leng; Junwu Zhao; Xiaoling Yuan; Zhenguang Li; Fang Li; Lai-Yu Kwok; Shukun Zhang; Zhihong Sun; Jinbiao Zhang; Heping Zhang
35583791,Exploring the multifactorial aspects of Gut Microbiome in Parkinson's Disease.,"Advanced research in health science has broadened our view in approaching and understanding the pathophysiology of diseases and has also revolutionised diagnosis and treatment. Ever since the establishment of Braak's hypothesis in the propagation of alpha-synuclein from the distant olfactory and enteric nervous system towards the brain in Parkinson's Disease (PD), studies have explored and revealed the involvement of altered gut microbiota in PD. This review recapitulates the gut microbiome associated with PD severity, duration, motor and non-motor symptoms, and antiparkinsonian treatment from recent literature. Gut microbial signatures in PD are potential predictors of the disease and are speculated to be used in early diagnosis and treatment. In brief, the review also emphasises on implications of the prebiotic, probiotic, faecal microbiota transplantation, and dietary interventions as alternative treatments in modulating the disease symptoms in PD.",Folia microbiologica,2022,Sujith Pavan; Arvind N Prabhu; Sankar Prasad Gorthi; Bhabatosh Das; Ankur Mutreja; Vignesh Shetty; Thandavarayan Ramamurthy; Mamatha Ballal
