pmid,title,abstract,journal,year,authors
34650532,Cross-Sectional Study on the Gut Microbiome of Parkinson's Disease Patients in Central China.,"Gastrointestinal dysfunction plays an important role in the occurrence and development of Parkinson's disease (PD). This study investigates the composition of the gut microbiome using shotgun metagenomic sequencing in PD patients in central China. Fecal samples from 39 PD patients (PD group) and the corresponding 39 healthy spouses of the patients (SP) were collected for shotgun metagenomics sequencing. Results showed a significantly altered microbial composition in the PD patients. <i>Bilophila wadsworthia</i> enrichment was found in the gut microbiome of PD patients, which has not been reported in previous studies. The random forest (RF) model, which identifies differences in microbiomes, reliably discriminated patients with PD from controls; the area under the receiver operating characteristic curve was 0.803. Further analysis of the microbiome and clinical symptoms showed that <i>Klebsiella</i> and <i>Parasutterella</i> were positively correlated with the duration and severity of PD, whereas hydrogen-generating <i>Prevotella</i> was negatively correlated with disease severity. The Cluster of Orthologous Groups of protein database, the KEGG Orthology database, and the carbohydrate-active enzymes of gene-category analysis showed that branched-chain amino acid-related proteins were significantly increased, and GH43 was significantly reduced in the PD group. Functional analysis of the metagenome confirmed differences in microbiome metabolism in the PD group related to short-chain fatty acid precursor metabolism.",Frontiers in microbiology,2021,Liangwei Mao; Yu Zhang; Jing Tian; Ming Sang; Guimin Zhang; Yuling Zhou; Puqing Wang
34576191,The Role of Gut Microbiota and Gut-Brain Interplay in Selected Diseases of the Central Nervous System.,"The gut microbiome has attracted increasing attention from researchers in recent years. The microbiota can have a specific and complex cross-talk with the host, particularly with the central nervous system (CNS), creating the so-called ""gut-brain axis"". Communication between the gut, intestinal microbiota, and the brain involves the secretion of various metabolites such as short-chain fatty acids (SCFAs), structural components of bacteria, and signaling molecules. Moreover, an imbalance in the gut microbiota composition modulates the immune system and function of tissue barriers such as the blood-brain barrier (BBB). Therefore, the aim of this literature review is to describe how the gut-brain interplay may contribute to the development of various neurological disorders, combining the fields of gastroenterology and neuroscience. We present recent findings concerning the effect of the altered microbiota on neurodegeneration and neuroinflammation, including Alzheimer's and Parkinson's diseases, as well as multiple sclerosis. Moreover, the impact of the pathological shift in the microbiome on selected neuropsychological disorders, i.e., major depressive disorders (MDD) and autism spectrum disorder (ASD), is also discussed. Future research on the effect of balanced gut microbiota composition on the gut-brain axis would help to identify new potential opportunities for therapeutic interventions in the presented diseases.",International journal of molecular sciences,2021,Julia Doroszkiewicz; Magdalena Groblewska; Barbara Mroczko
34576000,"Nuclear and Mitochondrial Genome, Epigenome and Gut Microbiome: Emerging Molecular Biomarkers for Parkinson's Disease.","Parkinson's disease (PD) is currently the second most common neurodegenerative disorder, burdening about 10 million elderly individuals worldwide. The multifactorial nature of PD poses a difficult obstacle for understanding the mechanisms involved in its onset and progression. Currently, diagnosis depends on the appearance of clinical signs, some of which are shared among various neurologic disorders, hindering early diagnosis. There are no effective tools to prevent PD onset, detect the disease in early stages or accurately report the risk of disease progression. Hence, there is an increasing demand for biomarkers that may identify disease onset and progression, as treatment-based medicine may not be the best approach for PD. Over the last few decades, the search for molecular markers to predict susceptibility, aid in accurate diagnosis and evaluate the progress of PD have intensified, but strategies aimed to improve individualized patient care have not yet been established.Genomic variation, regulation by epigenomic mechanisms, as well as the influence of the host gut microbiome seem to have a crucial role in the onset and progress of PD, thus are considered potential biomarkers. As such, the human nuclear and mitochondrial genome, epigenome, and the host gut microbiome might be the key elements to the rise of personalized medicine for PD patients.",International journal of molecular sciences,2021,Gleyce Fonseca Cabral; Ana Paula Schaan; Giovanna C Cavalcante; Camille Sena-Dos-Santos; Tatiane Piedade de Souza; Natacha M Souza Port's; Jhully Azevedo Dos Santos Pinheiro; Ândrea Ribeiro-Dos-Santos; Amanda F Vidal
34422879,Memorable Food: Fighting Age-Related Neurodegeneration by Precision Nutrition.,"Healthcare systems worldwide are seriously challenged by a rising prevalence of neurodegenerative diseases (NDDs), which mostly, but not exclusively, affect the ever-growing population of the elderly. The most known neurodegenerative diseases are Alzheimer's (AD) and Parkinson's disease, multiple sclerosis, and amyotrophic lateral sclerosis, but some viral infections of the brain and traumatic brain injury may also cause NDD. Typical for NDD are the malfunctioning of neurons and their irreversible loss, which often progress irreversibly to dementia and ultimately to death. Numerous factors are involved in the pathogenesis of NDD: genetic variability, epigenetic changes, extent of oxidative/nitrosative stress, mitochondrial dysfunction, and DNA damage. The complex interplay of all the above-mentioned factors may be a fingerprint of neurodegeneration, with different diseases being affected to different extents by particular factors. There is a voluminous body of evidence showing the benefits of regular exercise to brain health and cognitive functions. Moreover, the importance of a healthy diet, balanced in macro- and micro-nutrients, in preventing neurodegeneration and slowing down a progression to full-blown disease is evident. Individuals affected by NDD almost inevitably have low-grade inflammation and anomalies in lipid metabolism. Metabolic and lipid profiles in NDD can be improved by the Mediterranean diet. Many studies have associated the Mediterranean diet with a decreased risk of dementia and AD, but a cause-and-effect relationship has not been deduced. Studies with caloric restriction showed neuroprotective effects in animal models, but the results in humans are inconsistent. The pathologies of NDD are complex and there is a great inter-individual (epi)genetic variance within any population. Furthermore, the gut microbiome, being deeply involved in nutrient uptake and lipid metabolism, also represents a pillar of the gut microbiome-brain axis and is linked with the pathogenesis of NDD. Numerous studies on the role of different micronutrients (omega-3 fatty acids, bioactive polyphenols from fruit and medicinal plants) in the prevention, prediction, and treatment of NDD have been conducted, but we are still far away from a personalized diet plan for individual NDD patients. For this to be realized, large-scale cohorts that would include the precise monitoring of food intake, mapping of genetic variants, epigenetic data, microbiome studies, and metabolome, lipidome, and transcriptome data are needed.",Frontiers in nutrition,2021,Maja Milošević; Aleksandra Arsić; Zorica Cvetković; Vesna Vučić
34422393,"A discussion of the gut microbiome's development, determinants, and dysbiosis in cancers of the esophagus and stomach.","The microbiome refers to a population of microbes that colonize the skin, nasopharynx, oral cavity, gastrointestinal tract, and urogenital tract. The human microbiome consists of bacteria, archaea, fungi, viruses, and phages. Recent advances in genomic sequencing have catalyzed a deeper understanding of complex microbe-microbe and host-microbe interactions. Dysregulation of these interactions, or dysbiosis of the gastrointestinal tract, has been implicated in a growing list of pathologies including nonalcoholic fatty liver disease, cardiovascular disease, obesity, diabetes, depression, Parkinson's disease, autism, and various gastrointestinal cancers. Gastric and esophageal cancer, for example, continue to remain as two of the most common causes of cancer-related deaths worldwide, therefore there is an increased emphasis on investigating the role of dysbiosis on these cancers. In this review, we discuss the development and structure of the gut microbiome, its homeostatic and dysbiotic mechanisms, and the key microbes in esophageal and gastric carcinogenesis with a focus on bacterial biology. Further clarification of these pathways and discovery of diagnostic or therapeutic targets could have broad impacts on global subpopulations. It is important to understand the nature of the gastrointestinal tract microbiome and its potentional risk factors for dysbiosis in order to tailor its application to the individual patient and create an era of highly personalized, precision medicine.",Journal of gastrointestinal oncology,2021,Karan Grover; Stephanie Gregory; John F Gibbs; Nancy J Emenaker
34408160,Exploring human-genome gut-microbiome interaction in Parkinson's disease.,"The causes of complex diseases remain an enigma despite decades of epidemiologic research on environmental risks and genome-wide studies that have uncovered tens or hundreds of susceptibility loci for each disease. We hypothesize that the microbiome is the missing link. Genetic studies have shown that overexpression of alpha-synuclein, a key pathological protein in Parkinson's disease (PD), can cause familial PD and variants at alpha-synuclein locus confer risk of idiopathic PD. Recently, dysbiosis of gut microbiome in PD was identified: altered abundances of three microbial clusters were found, one of which was composed of opportunistic pathogens. Using two large datasets, we found evidence that the overabundance of opportunistic pathogens in PD gut is influenced by the host genotype at the alpha-synuclein locus, and that the variants responsible modulate alpha-synuclein expression. Results put forth testable hypotheses on the role of gut microbiome in the pathogenesis of PD, the incomplete penetrance of PD susceptibility genes, and potential triggers of pathology in the gut.",NPJ Parkinson's disease,2021,Zachary D Wallen; William J Stone; Stewart A Factor; Eric Molho; Cyrus P Zabetian; David G Standaert; Haydeh Payami
34357070,Association of Gut Microbiome Dysbiosis with Neurodegeneration: Can Gut Microbe-Modifying Diet Prevent or Alleviate the Symptoms of Neurodegenerative Diseases?,"The central nervous system was classically perceived as anatomically and functionally independent from the other visceral organs. But in recent decades, compelling evidence has led the scientific community to place a greater emphasis on the role of gut microbes on the brain. Pathological observations and early gastrointestinal symptoms highlighted that gut dysbiosis likely precedes the onset of cognitive deficits in Alzheimer's disease (AD) and Parkinson's disease (PD) patients. The delicate balance in the number and functions of pathogenic microbes and alternative probiotic populations is critical in the modulation of systemic inflammation and neuronal health. However, there is limited success in restoring healthy microbial biodiversity in AD and PD patients with general probiotics interventions and fecal microbial therapies. Fortunately, the gut microflora is susceptible to long-term extrinsic influences such as lifestyle and dietary choices, providing opportunities for treatment through comparatively individual-specific control of human behavior. In this review, we examine the impact of restrictive diets on the gut microbiome populations associated with AD and PD. The overall evidence presented supports that gut dysbiosis is a plausible prelude to disease onset, and early dietary interventions are likely beneficial for the prevention and treatment of progressive neurodegenerative diseases.","Life (Basel, Switzerland)",2021,Li Yang Tan; Xin Yi Yeo; Han-Gyu Bae; Delia Pei Shan Lee; Roger C Ho; Jung Eun Kim; Dong-Gyu Jo; Sangyong Jung
34346706,Gut Microbiome and Serum Metabolome Alterations Associated with Isolated Dystonia.,"Dystonia is a complex neurological movement disorder characterized by involuntary muscle contractions. Increasing studies implicate the microbiome as a possible key susceptibility factor for neurological disorders, but the relationship between the gut microbiota and dystonia remains poorly explored. Here, the gut microbiota of 57 patients with isolated dystonia and 27 age- and environment-matched healthy controls was analyzed by 16S rRNA gene amplicon sequencing. Further, integrative analysis of the gut microbiome and serum metabolome measured by high-performance liquid chromatography-mass spectrometry was performed. No difference in α-diversity was found, while β-diversity was significantly different, with a more heterogeneous community structure among dystonia patients than among controls. The most significant changes in dystonia highlighted an increase in <i>Clostridiales</i>, including Blautia obeum, Dorea longicatena, and Eubacterium hallii, and a reduction in Bacteroides vulgatus and Bacteroides plebeius. The functional analysis revealed that genes related to tryptophan and purine biosynthesis were more abundant in gut microbiota from patients with dystonia, while genes linked to citrate cycle, vitamin B<sub>6</sub>, and glycan metabolism were less abundant. The evaluation of serum metabolites revealed altered levels of l-glutamic acid, taurine, and d-tyrosine, suggesting changes in neurotransmitter metabolism. The most modified metabolites strongly inversely correlated with the abundance of members belonging to the <i>Clostridiales</i>, revealing the effect of the gut microbiota on neurometabolic activity. This study is the first to reveal gut microbial dysbiosis in patients with isolated dystonia and identified potential links between gut microbiota and serum neurotransmitters, providing new insight into the pathogenesis of isolated dystonia. <b>IMPORTANCE</b> Dystonia is the third most common movement disorder after essential tremor and Parkinson's disease. However, the cause for the majority of cases is not known. This is the first study so far that reveals significant alterations of gut microbiome and correlates the alteration of serum metabolites with gut dysbiosis in patients with isolated dystonia. We demonstrated a general overrepresentation of <i>Clostridiales</i> and underrepresentation of <i>Bacteroidetes</i> in patients with dystonia in comparison with healthy controls. The functional analysis found that genes related to the biosynthesis of tryptophan, which is the precursor of the neurotransmitter serotonin, were more active in isolated dystonia patients. Altered levels of several serum metabolites were found to be associated with microbial changes, such as d-tyrosine, taurine, and glutamate, indicating differences in neurotransmitter metabolism in isolated dystonia. Integrative analysis suggests that neurotransmitter system dysfunction may be a possible pathway by which the gut microbiome participates in the development of dystonia. The gut microbiome changes provide new insight into the pathogenesis of dystonia, suggesting new potential therapeutic directions.",mSphere,2021,Lingyan Ma; Jing Keng; Min Cheng; Hua Pan; Bo Feng; Yongfeng Hu; Tao Feng; Fan Yang
34250955,"Parkinson's Disease and the Gut: Symptoms, Nutrition, and Microbiota.","Parkinson's disease (PD) is the second most common neurodegenerative disease worldwide, characterized by symptoms of bradykinesia, rigidity, postural instability, and tremor. Recently, there has been a growing focus on the relationship between the gut and the development of PD. Emerging to the forefront, an interesting concept has developed suggesting that the initial pathophysiological changes occur in the gastrointestinal tract before changes are seen within the brain. This review is aimed at highlighting the relationship between PD and the gastrointestinal tract, along with the supporting evidence for this. Firstly, we will focus on the gastrointestinal conditions and symptoms which commonly affects patients, including both upper and lower gastrointestinal issues. Secondly, the impact of nutrition and diet on neurological health and PD physiology, with particular emphasis on commonly consumed items including macronutrients and micronutrients. Finally, variability of the gut microbiome will also be discussed and its link with both the symptoms and signs of PD. The evidence presented in this review highly suggests that the initial pathogenesis in the gut may proceed the development of prodromal PD subtypes, and therefore building on this further could be imperative and lead to earlier diagnosis with new and improved therapeutics.",Journal of Parkinson's disease,2021,Nehal Yemula; Celina Dietrich; Vaclav Dostal; Michael Hornberger
34216356,The Relationship Between the Gut Microbiome and Neurodegenerative Diseases.,"Many recent studies have shown that the gut microbiome plays important roles in human physiology and pathology. Also, microbiome-based therapies have been used to improve health status and treat diseases. In addition, aging and neurodegenerative diseases, including Alzheimer's disease and Parkinson's disease, have become topics of intense interest in biomedical research. Several researchers have explored the links between these topics to study the potential pathogenic or therapeutic effects of intestinal microbiota in disease. But the exact relationship between neurodegenerative diseases and gut microbiota remains unclear. As technology advances, new techniques for studying the microbiome will be developed and refined, and the relationship between diseases and gut microbiota will be revealed. This article summarizes the known interactions between the gut microbiome and neurodegenerative diseases, highlighting assay techniques for the gut microbiome, and we also discuss the potential therapeutic role of microbiome-based therapies in diseases.",Neuroscience bulletin,2021,Xueling Zhu; Bo Li; Pengcheng Lou; Tingting Dai; Yang Chen; Aoxiang Zhuge; Yin Yuan; Lanjuan Li
34205336,Regulation of Neurotransmitters by the Gut Microbiota and Effects on Cognition in Neurological Disorders.,"Emerging evidence indicates that gut microbiota is important in the regulation of brain activity and cognitive functions. Microbes mediate communication among the metabolic, peripheral immune, and central nervous systems via the microbiota-gut-brain axis. However, it is not well understood how the gut microbiome and neurons in the brain mutually interact or how these interactions affect normal brain functioning and cognition. We summarize the mechanisms whereby the gut microbiota regulate the production, transportation, and functioning of neurotransmitters. We also discuss how microbiome dysbiosis affects cognitive function, especially in neurodegenerative diseases such as Alzheimer's disease and Parkinson's disease.",Nutrients,2021,Yijing Chen; Jinying Xu; Yu Chen
34171417,The neuromicrobiology of Parkinson's disease: A unifying theory.,"Recent evidence confirms that PD is indeed a multifactorial disease with different aetiologies and prodromal symptomatology that likely depend on the initial trigger. New players with important roles as triggers, facilitators and aggravators of the PD neurodegenerative process have re-emerged in the last few years, the microbes. Having evolved in association with humans for ages, microbes and their products are now seen as fundamental regulators of human physiology with disturbances in their balance being increasingly accepted to have a relevant impact on the progression of disease in general and on PD in particular. In this review, we comprehensively address early studies that have directly or indirectly linked bacteria or other infectious agents to the onset and progression of PD, from the earliest suspects to the most recent culprits, the gut microbiota. The quest for effective treatments to arrest PD progression must inevitably address the different interactions between microbiota and human cells, and naturally consider the gut-brain axis. The comprehensive characterization of such mechanisms will help design innovative bacteriotherapeutic approaches to selectively shape the gut microbiota profile ultimately to halt PD progression. The present review describes our current understanding of the role of microorganisms and their endosymbiotic relatives, the mitochondria, in inducing, facilitating, or aggravating PD pathogenesis.",Ageing research reviews,2021,Mario F Munoz-Pinto; Nuno Empadinhas; Sandra M Cardoso
34079079,Compositional and genetic alterations in Graves' disease gut microbiome reveal specific diagnostic biomarkers.,"Graves' Disease is the most common organ-specific autoimmune disease and has been linked in small pilot studies to taxonomic markers within the gut microbiome. Important limitations of this work include small sample sizes and low-resolution taxonomic markers. Accordingly, we studied 162 gut microbiomes of mild and severe Graves' disease (GD) patients and healthy controls. Taxonomic and functional analyses based on metagenome-assembled genomes (MAGs) and MAG-annotated genes, together with predicted metabolic functions and metabolite profiles, revealed a well-defined network of MAGs, genes and clinical indexes separating healthy from GD subjects. A supervised classification model identified a combination of biomarkers including microbial species, MAGs, genes and SNPs, with predictive power superior to models from any single biomarker type (AUC = 0.98). Global, cross-disease multi-cohort analysis of gut microbiomes revealed high specificity of these GD biomarkers, notably discriminating against Parkinson's Disease, and suggesting that non-invasive stool-based diagnostics will be useful for these diseases.",The ISME journal,2021,Qiyun Zhu; Qiangchuan Hou; Shi Huang; Qianying Ou; Dongxue Huo; Yoshiki Vázquez-Baeza; Chaoping Cen; Victor Cantu; Mehrbod Estaki; Haibo Chang; Pedro Belda-Ferre; Ho-Cheol Kim; Kaining Chen; Rob Knight; Jiachao Zhang
34053243,Gut Microbiota and Parkinson's Disease: Implications for Faecal Microbiota Transplantation Therapy.,"Parkinson's disease (PD) ranks the second place among neurodegenerative diseases in terms of its morbidity, which affects 1-2% people aged over 65 years. In addition to genetics, some environmental factors may exert vital parts in PD occurrence as well. At present, more and more studies are conducted to elucidate the association between gut microbial dysbiosis and the incidence of PD. Gut microbial dysbiosis has a certain effect on both the central nervous system (CNS) and the enteric nervous system (ENS), which indicates that there is a gut-microbiota-brain axis that induces CNS disorders. Some gut microbial strains are suggested to suppress or weaken the neuroinflammation- and gut-inflammation-immune responses, which suggests the protective and pathogenic effects of certain gut microbial species on PD progression. Therefore, gut microbiome may contain plenty of targets for preventing and managing PD. Faecal microbiota transplantation (FMT) may serve as a direct and useful treatment for PD in the future. Nonetheless, there is little available scientific research in this field. The present work reviewed the latest research to examine the association of gut microbiota with PD, and the future prospects of FMT treatment.",ASN neuro,2021,Yongbo Kang; Xing Kang; Hongfang Zhang; Qingqing Liu; Hao Yang; Weiping Fan
