pmid,title,abstract,journal,year,authors
35281490,Mechanistic Insights Into Gut Microbiome Dysbiosis-Mediated Neuroimmune Dysregulation and Protein Misfolding and Clearance in the Pathogenesis of Chronic Neurodegenerative Disorders.,"The human gut microbiota is a complex, dynamic, and highly diverse community of microorganisms. Beginning as early as <i>in utero</i> fetal development and continuing through birth to late-stage adulthood, the crosstalk between the gut microbiome and brain is essential for modulating various metabolic, neurodevelopmental, and immune-related pathways. Conversely, microbial dysbiosis - defined as alterations in richness and relative abundances - of the gut is implicated in the pathogenesis of several chronic neurological and neurodegenerative disorders. Evidence from large-population cohort studies suggests that individuals with neurodegenerative conditions have an altered gut microbial composition as well as microbial and serum metabolomic profiles distinct from those in the healthy population. Dysbiosis is also linked to psychiatric and gastrointestinal complications - comorbidities often associated with the prodromal phase of Parkinson's disease (PD) and Alzheimer's disease (AD). Studies have identified potential mediators that link gut dysbiosis and neurological disorders. Recent findings have also elucidated the potential mechanisms of disease pathology in the enteric nervous system prior to the onset of neurodegeneration. This review highlights the functional pathways and mechanisms, particularly gut microbe-induced chronic inflammation, protein misfolding, propagation of disease-specific pathology, defective protein clearance, and autoimmune dysregulation, linking gut microbial dysbiosis and neurodegeneration. In addition, we also discuss how pathogenic transformation of microbial composition leads to increased endotoxin production and fewer beneficial metabolites, both of which could trigger immune cell activation and enteric neuronal dysfunction. These can further disrupt intestinal barrier permeability, aggravate the systemic pro-inflammatory state, impair blood-brain barrier permeability and recruit immune mediators leading to neuroinflammation and neurodegeneration. Continued biomedical advances in understanding the microbiota-gut-brain axis will extend the frontier of neurodegenerative disorders and enable the utilization of novel diagnostic and therapeutic strategies to mitigate the pathological burden of these diseases.",Frontiers in neuroscience,2022,Piyush Padhi; Carter Worth; Gary Zenitsky; Huajun Jin; Kumar Sambamurti; Vellareddy Anantharam; Arthi Kanthasamy; Anumantha G Kanthasamy
35207632,Gastrointestinal Dysfunction in Parkinson's Disease: Current and Potential Therapeutics.,"Abnormalities in the gastrointestinal (GI) tract of Parkinson's disease (PD) sufferers were first reported over 200 years ago; however, the extent and role of GI dysfunction in PD disease progression is still unknown. GI dysfunctions, including dysphagia, gastroparesis, and constipation, are amongst the most prevalent non-motor symptoms in PD. These symptoms not only impact patient quality of life, but also complicate disease management. Conventional treatment pathways for GI dysfunctions (i.e., constipation), such as increasing fibre and fluid intake, and the use of over-the-counter laxatives, are generally ineffective in PD patients, and approved compounds such as guanylate cyclase C agonists and selective 5-hyroxytryptamine 4 receptor agonists have demonstrated limited efficacy. Thus, identification of potential targets for novel therapies to alleviate PD-induced GI dysfunctions are essential to improve clinical outcomes and quality of life in people with PD. Unlike the central nervous system (CNS), where PD pathology and the mechanisms involved in CNS damage are relatively well characterised, the effect of PD at the cellular and tissue level in the enteric nervous system (ENS) remains unclear, making it difficult to alleviate or reverse GI symptoms. However, the resurgence of interest in understanding how the GI tract is involved in various disease states, such as PD, has resulted in the identification of novel therapeutic avenues. This review focuses on common PD-related GI symptoms, and summarizes the current treatments available and their limitations. We propose that by targeting the intestinal barrier, ENS, and/or the gut microbiome, may prove successful in alleviating PD-related GI symptoms, and discuss emerging therapies and potential drugs that could be repurposed to target these areas.",Journal of personalized medicine,2022,Myat Noe Han; David I Finkelstein; Rachel M McQuade; Shanti Diwakarla
35203906,Parkinson's Disease in Light of the COVID-19 Pandemic.,"In this review we attempt to collate the existing scientific evidence regarding the possible role of severe acute respiratory syndrome coronavirus 2 (SARS-CoV-2) in the pathophysiology of Parkinson's disease (PD), as well as to investigate the impact of PD/parkinsonism on the clinical course of the viral infection itself. Since etiology of PD is not completely understood, various studies suggest different potential links between coronavirus disease 2019 (COVID-19) and PD. Suggested connections include, among others, similar prodromal symptoms, renin-angiotensin-aldosterone system involvement, or gut microbiome dysbiosis participation. Despite the initial assumptions that, as a mainly elderly population suffering from rigidity of respiratory muscles, impairment of cough reflex, and dyspnea, PD patients would be more susceptible to viral infection, and would experience a more aggressive course of COVID-19, the published scientific reports contain mutually exclusive data that require further investigation and meta-analysis.",Brain sciences,2022,Anna Drelich-Zbroja; Mateusz Cheda; Maryla Kuczyńska; Izabela Dąbrowska; Ewa Kopyto; Izabela Halczuk
35189807,Rifaximin modulates TRH and TRH-like peptide expression throughout the brain and peripheral tissues of male rats.,"The TRH/TRH-R1 receptor signaling pathway within the neurons of the dorsal vagal complex is an important mediator of the brain-gut axis. Mental health and protection from a variety of neuropathologies, such as autism, Attention Deficit Hyperactivity Disorder, Alzheimer's and Parkinson's disease, major depression, migraine and epilepsy are influenced by the gut microbiome and is mediated by the vagus nerve. The antibiotic rifaximin (RF) does not cross the gut-blood barrier. It changes the composition of the gut microbiome resulting in therapeutic benefits for traveler's diarrhea, hepatic encephalopathy, and prostatitis. TRH and TRH-like peptides, with the structure pGlu-X-Pro-NH<sub>2</sub>, where ""X"" can be any amino acid residue, have reproduction-enhancing, caloric-restriction-like, anti-aging, pancreatic-β cell-, cardiovascular-, and neuroprotective effects. TRH and TRH-like peptides occur not only throughout the CNS but also in peripheral tissues. To elucidate the involvement of TRH-like peptides in brain-gut-reproductive system interactions 16 male Sprague-Dawley rats, 203 ± 6 g, were divided into 4 groups (n = 4/group): the control (CON) group remained on ad libitum Purina rodent chow and water for 10 days until decapitation, acute (AC) group receiving 150 mg RF/kg powdered rodent chow for 24 h providing 150 mg RF/kg body weight for 200 g rats, chronic (CHR) animals receiving RF for 10 days; withdrawal (WD) rats receiving RF for 8 days and then normal chow for 2 days.Significant changes in the levels of TRH and TRH-like peptides occurred throughout the brain and peripheral tissues in response to RF. The number of significant changes in TRH and TRH-like peptide levels in brain resulting from RF treatment, in descending order were: medulla (16), piriform cortex (8), nucleus accumbens (7), frontal cortex (5), striatum (3), amygdala (3), entorhinal cortex (3), anterior (2), and posterior cingulate (2), hippocampus (1), hypothalamus (0) and cerebellum (0). The corresponding ranking for peripheral tissues were: prostate (6), adrenals (4), pancreas (3), liver (2), testis (1), heart (0).The sensitivity of TRH and TRH-like peptide expression to RF treatment, particularly in the medulla oblongata and prostate, is consistent with the participation of these peptides in the therapeutic effects of RF.",BMC neuroscience,2022,Albert Eugene Pekary; Albert Sattin
35163103,Gut-Brain Axis as a Pathological and Therapeutic Target for Neurodegenerative Disorders.,"Human lifestyle and dietary behaviors contribute to disease onset and progression. Neurodegenerative diseases (NDDs), considered multifactorial disorders, have been associated with changes in the gut microbiome. NDDs display pathologies that alter brain functions with a tendency to worsen over time. NDDs are a worldwide health problem; in the US alone, 12 million Americans will suffer from NDDs by 2030. While etiology may vary, the gut microbiome serves as a key element underlying NDD development and prognosis. In particular, an inflammation-associated microbiome plagues NDDs. Conversely, sequestration of this inflammatory microbiome by a correction in the dysbiotic state of the gut may render therapeutic effects on NDDs. To this end, treatment with short-chain fatty acid-producing bacteria, the main metabolites responsible for maintaining gut homeostasis, ameliorates the inflammatory microbiome. This intimate pathological link between the gut and NDDs suggests that the gut-brain axis (GBA) acts as an underexplored area for developing therapies for NDDs. Traditionally, the classification of NDDs depends on their clinical presentation, mostly manifesting as extrapyramidal and pyramidal movement disorders, with neuropathological evaluation at autopsy as the gold standard for diagnosis. In this review, we highlight the evolving notion that GBA stands as an equally sensitive pathological marker of NDDs, particularly in Alzheimer's disease, Parkinson's disease, amyotrophic lateral sclerosis and chronic stroke. Additionally, GBA represents a potent therapeutic target for treating NDDs.",International journal of molecular sciences,2022,Alma Rosa Lezama Toledo; Germán Rivera Monroy; Felipe Esparza Salazar; Jea-Young Lee; Shalini Jain; Hariom Yadav; Cesario Venturina Borlongan
35145822,Constipation and Cigarette Smoking Are Independent Influences for Parkinson's Disease.,"Background Tobacco smokers have reduced Parkinson's disease (PD) risk. Some patients with PD experience constipation long before they develop mobility problems, and constipation is a frequent complaint of people who try to stop smoking. Recently, the gut microbiome has been implicated in PD. Methods In the present study, we analyzed the relationship between smoking and constipation in subjects with PD and controls. We wished to determine whether the effects of smoking and constipation were independent or whether they might be interrelated. To evaluate the relationship, we used a cohort of subjects from the UK Biobank (UKB). Results In 501,174 subjects, the decreased risk of Parkinson's disease with increased smoking was significant (p < 0.001, two-tailed Fisher's exact test). The increased risk of constipation in subjects with PD was significant (p = 0.001, two-tailed Fisher's exact test). Logistic regression was performed; sex, age, constipation, and smoking were the independent variables, and PD present or absent was the dependent variable. The PD odds ratio (OR) for males was 1.790 (95% confidence interval (CI): 1.629-1.966) times that for females, indicating that PD is more common in men. The risk of PD increased by 1.140 (95% CI: 1.131-1.149) with every year of age. Constipation increased the risk of PD by 4.043 (95% CI: 1.901-8.599). Smoking diminished PD risk by 0.772 (95% CI: 0.690-0.863). Drinking coffee was associated with a reduced risk of PD (OR: 0.815 (95% CI: 0.730-0.909). Drinking tea reduced PD risk by 0.979 (95% CI: 0.962-0.997) for each cup per day. The effects of sex, age, constipation, smoking, drinking coffee, and drinking tea were independent and significant. Conclusion Our analysis suggests that the favorable effect of smoking on PD is independent of the detrimental effect of constipation. Smoking reduces PD risk because it not only stimulates the bowel to empty and prevents constipation but also alters the gut microbiome. Another factor, perhaps the tobacco component diterpenoids, may be responsible for the PD risk-reducing effect.",Cureus,2022,Steven Lehrer; Peter H Rheinstein
35111696,Gut Microbiota: A Key Regulator in the Effects of Environmental Hazards on Modulates Insulin Resistance.,"Insulin resistance is a hallmark of Alzheimer's disease (AD), type II diabetes (T2D), and Parkinson's disease (PD). Emerging evidence indicates that these disorders are typically characterized by alterations in the gut microbiota composition, diversity, and their metabolites. Currently, it is understood that environmental hazards including ionizing radiation, toxic heavy metals, pesticides, particle matter, and polycyclic aromatic hydrocarbons are capable of interacting with gut microbiota and have a non-beneficial health effect. Based on the current study, we propose the hypothesis of ""gut microenvironment baseline drift"". According to this ""baseline drift"" theory, gut microbiota is a temporarily combined cluster of species sharing the same environmental stresses for a short period, which would change quickly under the influence of different environmental factors. This indicates that the microbial species in the gut do not have a long-term relationship; any split, division, or recombination may occur in different environments. Nonetheless, the ""baseline drift"" theory considers the critical role of the response of the whole gut microbiome. Undoubtedly, this hypothesis implies that the gut microbiota response is not merely a ""cross junction"" switch; in contrast, the human health or disease is a result of a rich palette of gut-microbiota-driven multiple-pathway responses. In summary, environmental factors, including hazardous and normal factors, are critical to the biological impact of the gut microbiota responses and the dual effect of the gut microbiota on the regulation of biological functions. Novel appreciation of the role of gut microbiota and environmental hazards in the insulin resistance would shed new light on insulin resistance and also promote the development of new research direction and new overcoming strategies for patients.",Frontiers in cellular and infection microbiology,2021,Ruixue Huang
35083314,The small bowel microbiome changes significantly with age and aspects of the ageing process.,"Gut microbiome changes have been associated with human ageing and implicated in age-related diseases including Alzheimer's disease and Parkinson's disease. However, studies to date have used stool samples, which do not represent the entire gut. Although more challenging to access, the small intestine plays critical roles in host metabolism and immune function. In this paper (Leite <i>et al.</i> (2021), Cell Reports, doi: 10.1016/j.celrep.2021.109765), we demonstrate significant differences in the small intestinal microbiome in older subjects, using duodenal aspirates from 251 subjects aged 18-80 years. Differences included significantly decreased microbial diversity in older subjects, driven by increased relative abundance of phylum Proteobacteria, particularly family Enterobacteriaceae and coliform genera <i>Escherichia</i> and <i>Klebsiella.</i> Moreover, while this decreased diversity was associated with the 'ageing process' (comprising chronologic age, number of medications, and number of concomitant diseases), changes in certain taxa were found to be associated with number of medications alone (<i>Klebsiella</i>), number of diseases alone (<i>Clostridium, Bilophila</i>), or chronologic age alone (<i>Escherichia</i>, <i>Lactobacillus, Enterococcus</i>). Lastly, many taxa associated with increasing chronologic age were anaerobes. These changes may contribute to changes in human health that occur during the ageing process.","Microbial cell (Graz, Austria)",2022,Gabriela Leite; Mark Pimentel; Gillian M Barlow; Ruchi Mathur
35069178,The Gut-Brain Axis and Its Relation to Parkinson's Disease: A Review.,"Parkinson's disease is a chronic neurodegenerative disease characterized by the accumulation of misfolded alpha-synuclein protein (Lewy bodies) in dopaminergic neurons of the <i>substantia nigra</i> and other related circuitry, which contribute to the development of both motor (bradykinesia, tremors, stiffness, abnormal gait) and non-motor symptoms (gastrointestinal issues, urinogenital complications, olfaction dysfunction, cognitive impairment). Despite tremendous progress in the field, the exact pathways and mechanisms responsible for the initiation and progression of this disease remain unclear. However, recent research suggests a potential relationship between the commensal gut bacteria and the brain capable of influencing neurodevelopment, brain function and health. This bidirectional communication is often referred to as the microbiome-gut-brain axis. Accumulating evidence suggests that the onset of non-motor symptoms, such as gastrointestinal manifestations, often precede the onset of motor symptoms and disease diagnosis, lending support to the potential role that the microbiome-gut-brain axis might play in the underlying pathological mechanisms of Parkinson's disease. This review will provide an overview of and critically discuss the current knowledge of the relationship between the gut microbiota and Parkinson's disease. We will discuss the role of α-synuclein in non-motor disease pathology, proposed pathways constituting the connection between the gut microbiome and the brain, existing evidence related to pre- and probiotic interventions. Finally, we will highlight the potential opportunity for the development of novel preventative measures and therapeutic options that could target the microbiome-gut-brain axis in the context of Parkinson's disease.",Frontiers in aging neuroscience,2021,Emily M Klann; Upuli Dissanayake; Anjela Gurrala; Matthew Farrer; Aparna Wagle Shukla; Adolfo Ramirez-Zamora; Volker Mai; Vinata Vedam-Mai
35057561,Are We What We Eat? Impact of Diet on the Gut-Brain Axis in Parkinson's Disease.,"Parkinson's disease is characterized by motor and non-motor symptoms, such as defects in the gut function, which may occur before the motor symptoms. To date, there are therapies that can improve these symptoms, but there is no cure to avoid the development or exacerbation of this disorder. Dysbiosis of gut microbiota could have a crucial role in the gut-brain axis, which is a bidirectional communication between the central nervous system and the enteric nervous system. Diet can affect the microbiota composition, impacting gut-brain axis functionality. Gut microbiome restoration through probiotics, prebiotics, synbiotics or other dietary means could have the potential to slow PD progression. In this review, we will discuss the influence of diet on the bidirectional communication between gut and brain, thus supporting the hypothesis that this disorder could begin in the gut. We also focus on how food-based therapies might then have an influence on PD and could ameliorate non-motor as well as motor symptoms.",Nutrients,2022,Margherita Alfonsetti; Vanessa Castelli; Michele d'Angelo
35055364,Microbiome Changes in Humans with Parkinson's Disease after Photobiomodulation Therapy: A Retrospective Study.,"There is a paucity of information on the effect of photobiomodulation therapy on gut microbiome composition. Parkinson's disease is a progressive neurological disorder with few management options, although the gut microbiome has been suggested as a potential avenue of treatment. We retrospectively analysed the microbiome from human stool samples from a previously published study, which had demonstrated the efficacy of photobiomodulation to treat Parkinson's patients' symptoms. Specifically, we have observed changes in the microbiome of Parkinson's patients after a 12-week treatment regimen with photobiomodulation to the abdomen, neck, head and nose. Noted were positive changes in the Firmicutes to Bacteroidetes (F:B) ratio, which is often interpreted as a proxy for gut health.",Journal of personalized medicine,2022,Brian Bicknell; Ann Liebert; Craig S McLachlan; Hosen Kiat
35032636,Impact of intestinal disorders on central and peripheral nervous system diseases.,"Brain injuries and neurological diseases have a significant impact on the gut microbiome and the gut barrier. Reciprocally, gut disorders, such as Inflammatory Bowel Syndromes (IBS), can affect the development and pathology of neurodegenerative and neuropsychiatric diseases, although this aspect is less well studied and is the focus of this review. Inflammatory Bowel Syndrome (IBS) is a chronic and debilitating functional gastrointestinal disorder afflicting an estimated 9-23% of the world's population. A hallmark of this disease is leaky gut, a pathology in which the integrity of the gut blood barrier is compromised, causing gut contents such as immune cells and microbiota to enter the bloodstream leading to low-grade systemic inflammation. The increased levels of inflammation associated cytokines in circulation has the potential to affect all organs, including the brain. Although the brain is protected by the blood brain barrier, inflammation associated cytokines can damage the junctions in this barrier and allow brain infiltration of peripheral immune cells. Central inflammation in the brain is associated with various neurodegenerative disease such as Alzheimer's disease, Parkinson's disease, multiple sclerosis, and neuropsychiatric disorders, namely, depression, and anxiety. Neurodegenerative diseases are of particular concern due to the anticipated rise in the population of the elderly and consequently, the prevalence of these diseases. Additionally, depression and anxiety are the most common mental illnesses affecting roughly 18% of the American population. In this review, we will explore the mechanisms by which IBS can influence the risk and severity of neurological disease.",Neurobiology of disease,2022,Yumna El-Hakim; Shameena Bake; Kathiresh Kumar Mani; Farida Sohrabji
34985325,A Comprehensive Review on the Role of the Gut Microbiome in Human Neurological Disorders.,"The human body is full of an extensive number of commensal microbes, consisting of bacteria, viruses, and fungi, collectively termed the human microbiome. The initial acquisition of microbiota occurs from both the external and maternal environments, and the vast majority of them colonize the gastrointestinal tract (GIT). These microbial communities play a central role in the maturation and development of the immune system, the central nervous system, and the GIT system and are also responsible for essential metabolic pathways. Various factors, including host genetic predisposition, environmental factors, lifestyle, diet, antibiotic or nonantibiotic drug use, etc., affect the composition of the gut microbiota. Recent publications have highlighted that an imbalance in the gut microflora, known as dysbiosis, is associated with the onset and progression of neurological disorders. Moreover, characterization of the microbiome-host cross talk pathways provides insight into novel therapeutic strategies. Novel preclinical and clinical research on interventions related to the gut microbiome for treating neurological conditions, including autism spectrum disorders, Parkinson's disease, schizophrenia, multiple sclerosis, Alzheimer's disease, epilepsy, and stroke, hold significant promise. This review aims to present a comprehensive overview of the potential involvement of the human gut microbiome in the pathogenesis of neurological disorders, with a particular emphasis on the potential of microbe-based therapies and/or diagnostic microbial biomarkers. This review also discusses the potential health benefits of the administration of probiotics, prebiotics, postbiotics, and synbiotics and fecal microbiota transplantation in neurological disorders.",Clinical microbiology reviews,2022,Shokufeh Ghasemian Sorboni; Hanieh Shakeri Moghaddam; Reza Jafarzadeh-Esfehani; Saman Soleimanpour
